"My colleagues in Opinion, Meeta included, did a stunning job with this climate package. Spend some time with it, and if you know anyone who's on the fence about climate change, send it to them. "
"RT There is no climate emergency. There is no COVID emergency. There is only you and how far you are willing to fall for the lies of the hypocritical, power hungry elite. Stand up. Don't allow them to jab your kids. They don't need it. There is strength in numbers. #Resist"
"In 2021 we dealt with rampant fires, floods, and tornadoes. Next year will be worse. And every year after, on average, will escalate the climate crisis. At some point we will have lost the luxury of choice. True Cost will no longer be a radical option, but an urgent necessity."
Exactly. There is no other way to achieve that. Co2 is harmless anyway. There's no climate emergency or any need for this sustainable nonsense. #EndTheScamdemic #DoNotComply
"We are back this week for another episode of LIGHT ROOMS w/ of for a rich discussion on the creator economy + scaling climate action via #web3. Thursday, Feb. 10th 4PM EST Hosted by: @MaxieRyan Set your reminders: "
"RT We live in a world of warmer, more violent weather. Stronger storms, longer droughts, heavier floods, larger fires, notes the editorial board. The planet is sending an SOS. "
The repukians climate change deniers the demorats climate change enablers no difference time for change? 
They're fighting the pandemic just like they've fought climate change. They put money over lives. Period. 
"I'm trying to ignore this DL Hughley, Kanye situation. BECAUSE the world burning down you got climate change the storm just knocked the hell out of the East Coast, but everybody worried about Kanye Westand Pete Davidson?!?! People in their priorities. "
Stop cutting trees climate change is real but pay back is (realer)   
"RT People who say we have ""bigger problems than climate change"" simply do not understand the gravity of climate change. Every single problem you can think of will get worse with climate change. Dwindling economy? Public Health? Crime? Food? Water? All worse."
"This is Earth, we're in a climate crisis, we need to reduce asap oil, coal and gas."
Nations must use the most cost effective means to produce power: If you are in the middle of a desert than solar makes sense; if you are blessed with rivers than use hydro and if you are sitting on top of large coal deposits than use fossil fuels. #ClimateAction #climatechange 
Devastating is the way you and your government do next to bugger all about climate change - these weather events will just get worse and worse. You are a planet killer.
"If it has occurred to you that humanity needs to wake up from the matrix of illusion before our sociopathic rulers drive us to extinction via environmental catastrophe or nuclear armageddon, then your notes match my own. "
"Climate change is a threat multiplier, intensifying other problems. Case in point: The housing crisis. "
"I think he needs a narrative that relates to lived experience not political science questions. He's working on prosperity but he needs to focus on security - protection from crime, illness and climate change."
Im confused! You worry about the effect of the budget deficit on your 10 grandchildren but dont seem to care how Climate Change will affect them. You're legacy will be one of shame. Putting your profits above their well-being. @SenDuckworth
BBC News - Extinction Rebellion protests block Vauxhall and Lambeth bridges 
"Earth's sixth mass extinction has ended, and survivors who've struggled with unhealthy air, food rations and regimented energy consumption are now faced with new challenges when a detective investigates a string of inconceivable deaths. CC: "
"The move away from Russian gas is part of a move away from fossil fuels entirely, so I don't think American shipments of LNG would be a feasible replacement."
Our #WeCantWait slatethat we need to act now on the climate crisis. 
That wasn't extreme weather. I drive through worse each winter. No problems. That was extreme incompetence at keeping the roads maintained and suitable for traffic.
that darn climate change attacking our poor caddies
Are there any major storms in the area? You would expect there to be with extreme variation in the temperature.
"Typically, the patient just died. And there were plants that were used in the treatment of diabetes that are farmed into extinction because of it."
"RT Journalist delves into our audacious mission to save the world by making clean energy more competitive, accessible and powerful. Read more on #5BillionYears #innovation #solar"
"Milloy ignores, of course, very real Global Warming burdens for states, residents and US taxpayers. Regulations are the least of our worries! Think epic drought, massive wildfires, extreme temperatures, storms and rising sea levels. In short, real costs and devastation. "
"My name is Jon Kaiman. When superstorm Sandy hit New York, the Governor called me to assist recovery efforts in the state. Now, I am jumping in to run for Congress because there is more we can do to curb the climate crisis. Help me amplify my message by retweeting and following."
"The property of my summer workplace was taken in the fires. The forest that surrounds it, 2 years down the track, only just recovering. Fire burnt so hot it took the roots of the trees"
Understanding Healthy Soil & Climate Change - Steps Everyone Can Take: #soil #healthysoil #plant #plants #climate #climatechange #climateaction #garden #carbon #carbonsequestration #backyard #GHGs #compost #nature #environment #sustainability #agriculture 
"Good on them. The corporate media are the number one problem. Poverty, war, climate change, racism, transphobia etc...etc... nothing gets fixed until activists start regularly targeting media outlets ."
Flood-ravaged villages in Kottayam district hit by severe drought 
"RT This baby is being cared for in the malnutrition unit of a UNICEF-supported hospital in Kabul, Afghanistan. As families struggle with conflict, COVID-19 and climate change, they need support more than ever. "
"My genre fluid prose poem with is out today! We've got land acknowledgments, climate change, and blue collar labor in one poem yall. Yo boy got a skull   "
"Nothing will damage the economy or make life more expensive than climate change. Read the IPCC 6 report, @jkenney"
"Is the new ""state of disaster"" the start of climate change lockdowns?"
"""Unless we match climate rhetoric with #ClimateAction, we will condemn ourselves to a hotter, more volatile earth - with worsening disasters & mass displacement.We must go into emergency mode against the climate crisis."" - "
"RT ""Polluted water runoff from agriculture, sewage and other man-made development has caused algae blooms in estuaries, choking off the seagrass upon which manatees rely. Climate change is worsening the problem."" "
Carbon monoxide is a largely insignificant greenhouse gas
"RT ""ExxonMobil is the greatest single-use plastic waste polluter in the world, contributing 5.9m tonnes to the global waste mountain."" Fossil fuels and the plastic crisis are two faces of the same dirty coin. #BreakFreeFromPlastic #ClimateEmergency "
By the way it takes fossil fuels to mine the materials in lithium batteries.
"A 2 year old understands this. This evil regime wants fossil fuel to go sky high so they can implement their idiotic climate agenda. Problem is, NOTHING can surpass fossil fuels and the scam of climate change is just that! China is the ultimate raper of the earth, enforce them."
"RT This is why we were pushing so much world leaders at COP26 to approve loss and damage funds. The impacts of Climate change continue to kill and displace a thousand of people in least the developed countries. Today it is Malaysia, this shouldn't be like these,it's time we act. "
More like distract from his son's money laundering! Kerry's gotta STFU when it comes to all his phony leftist global warming PROPAGANDA as he owns and flies around in a dozen or more private jets  
So let's advocate for better policy that doesn't lay the consequences of climate change at people's feet even if we've all sort of cooled off on blaming people for climate change in year of our lord 2021. Let's not make them pay for it too now. That's my goal for 2022.
Young people from Camelon and Tamfourhill can play a central role in the next few months with designing our Community Climate Action Plan #tidycleangreen 
French activists are asking their leaders to #LookUp  and see the climate crisis! 
Agreed with Transition for we can see that playing out in real time with Europe and energy pricing along with poor thought and pandering to climate extinction crowds
This is INSANE! How can we let this happened as we are facing an extinction-level climate crisis?! 
Whoever wants to lead the republicans needs to step up and lead now. Rally your party to fight and help Ukraine. Stop Russian oil and supply Ukraine militarily. Stop worrying about climate change &increase oil production now or we will not have a tomorrow. Get a backbone & fight
British Columbia: Floods andlandslides trap people on highway via So angry news media aren't screaming climate emergency daily until it sinks in! WTF!
"RT Is anyone on #qanda going to discuss the $250 billion extortion being inflicted on the Australian public by the Nationals in return for acting on the ""Code Red for Humanity"" climate crisis?"
"Across Greece, conservation NGOs are working in close collaboration to study and save numerous endemic species found nowhere else, reports: "
"Ever wonder why Washington makes such bad decisions on climate change, social policy, basic human needs, etc? A big part of it is stubborn ignorance. Despite the availability of hard facts and sound solutions, these people won't read. "
"RT ""the climate crisis has nothing to do with colonization and imperialism"" "
"What the reports say is this: - Climate change is already happening, how severe it will be will be up to us and the action we take int evan next 8 years - It could either get somewhat shitty or VERY VERY shitty. Either way things are getting worse"
"""Brace for food rationing"" and non-linear price increases. Everything is going up vertically. The whole production chain for food is under pressure from every side. I have never seen anything like it in 30 years."" When climate shocks meet war shocks. "
"Huh. I thought the civil war was gonna be caused by climate change (i.e. fighting over water, gas, food, viable land as the coast line rises, ect.) Guess we just can't wait for all that. Why do we suck so much?"
I'm fighting against the fight against climate change. I have 2 gas stoves that are always running.
"RT .taken action to combat the climate crisis with the largest investment in U.S. history that cuts pollution, creates good-paying jobs and invests in America. The #BuildBackBetter Actadvances visionof Americaleading the worldin a clean energyfuture."
"Scientists have been warning about the risks of burning fossil fuels for generations. It's already too late to prevent harm, but it's not too late to prevent the worst. We have the solutions. #ActOnClimate #ClimateCrisis #climate #energy "
The Climate Change cult wants us to eat bugs and freeze to death in the dark.
"RT Climate strike #COP26 Today we once again demanded justice; using our united voice calling for real climate action from our politicians. The fight for change isn't a choice but a necessity, this fight is life or death for many now and many more to come. #FridaysForFuture "
Will he refuse the coal because of his global warming handlers reject hydro carbon based energy
"Why won't kyrsten sinema vote like a dem She won't lower prescription drugs She won't vack voting rights She won't protect women's rights to choose She won't support expanding childcare, fight climate change. Too bad kyrsten sinema's lobbyists hate them"
RT US power companies are ramping up their coal consumption due to surging natural gas prices. US coal-fired generation is expected to surge by 22% in 2021 
"It's not just adults that are doing their part for climate change Bridge of Allan Squirrels wanted to do a litter pick to clean up their local area. So, 16 Squirrels, 6 Leaders and 2 Young Leaders walked to the local park, to litter pick in pairs. Well done Squirrels!  "
"Respondents to the 2022 World Economic Forum Global Risks survey ranked 'Climate action failure' as the number one risk with the most severe impact over the next decade. Extreme weather due to climate change is second, biodiversity loss third. "
How I'm feeling right now .. Spring my ass  Global warming bite me!!! So sick of winter weather! (one of those nites ) 
Will literally try to block the sun rather than stop burning fossil fuels
"RT So I'm hearing Oct 2nd is protest day. And not just women should be protesting. All of America should be protesting. We need to demand our justice dept act on these backward anti abortion state laws, demand voting rights FOR ALL, demand action on climate change."
"Some politicians blame soaring energy costs on the global drive to cut carbon emissions. Yet climate change policies don't explain the price spike. The criticism risks undermining tougher challenges like reducing demand for power, writes "
Fossil fuel firms like use advertising to claim to be green while their core business remains in fossil fuels. It's time to #BanFossilAds and stop these destructive companies from misleading us. Join the movement: https://t.co/NHYE2CZTay #FossilFreeRevolution 
Taxing people into poverty won't change the weather or climate.
RT The climate crisis will continue & we all must do what we can to drive solutions because governments have already proven they will do too little. Global crises will demand attention & we must stand up to threats while also resisting attempts to draw us into new costly conflicts.
RT if i die in the climate crisis yall better politicize the everloving shit out of my death. mail my ashes to the american petroleum institute and throw my urn at mitch
RT Huge toll of disasters linked to climate change 
"RT Apple, Amazon, Microsoft & Disney among companies backing groups against US climate bill, despite promises to combat the climate crisis. "
Earth is already becoming unlivable. Will governments act to stop this disaster from getting worse? https://t.co/QDDwxft3Eo @FFF_Jour #ClimateCrisis #ClimateDenial #EndFossilFuels #twiff #ClimateTalk
"All life on Earth, from ecosystems to human civilization, is vulnerable to climate change. Unprecedented changes to the climate have already affected all forms of life, in every part of the world. We must act now.  #DemVoice1 "
"Today I fully recommend this brilliant book* by Vanessa It's about the experience of climate activism, about the consequences of the climate emergency especially in Africa and! About racism, gender inequality and social unjust!  "
"In Africa, climate change is no longer a threat but a reality."
"1/2 tycoons,all those who deny Climate Crisis (created by MANKIND,so forget Climate Change'). It is beyond dystopian horror. Yet after 2019 Australia Catastrophe our policy and decision makers are still SLEEPING. GRETA THUNBERG FOR FUCKING WORLD PRESIDENT NOW! "
"New IPCC report shows Australia is at real risk from climate change, with impacts worsening, future risks high, and wide-ranging adaptation needed via @ConversationEDU"
RT Google and YouTube will ban climate deniers from monetizing their content on their platforms via ads or creator payments. 
"There's also _Climate Change 2022: Impacts, Adaptation and Vulnerability_ The Impacts, Adaptation Vulnerability is , for so many, going to be brutal and tied to the MIC"
"RT Climate change denier is the new racist isn't it? So utterly dull, predictable & intellectually feeble "
"War, climate change, Covid, nuclear fallout. Fear, fear, fear, fear. "
David McWilliams: Europe's crisis a chance to shift away from reliance on Russian fossil fuels 
Sitting having coffee on a town bench They're ruining beautiful days causing more climate crisis & harm to environmental health 
"One of Biden's campaign promises was to END FOSSIL FUELS. Funny how he only tries to keep the promises that HURT AMERICANS, not help them."
"""The game isnt political"" *game proceeds to cover global warming, the effects of war, the horrors of weapons of mass destruction, genocide, consumerism, energy consumption and the harsh realities of overpopulation*"
"Missing a few key Philausophies Racism, sexism, imprisoning asylum seekers/refugees, women being murdered every week, failing health & aged care systems, MPs getting away with literal crimes & corruption, no climate action, right wing media controlling the Govt"
"RT The term ""Professor"" is functionally supremacist, promoting the presumption that people need to be taught. The term ""Bestselling Author"" is a fraught with climate change denial, promoting destruction of trees for printing. And ""term"" is from the patriarchal label system. "
"What does a #COVID19 wrongful death suit against a pork producer have in common with a #climatechange lawsuit? Both should be argued at the state level, attorneys for Hawaii communities fighting climate change say: "
"We already knew that airlines could not give a sh*t to the climate crisis, now they also could not give a s*it to the covid crisis "
RT .* Make the fight against climate change sexy & fun! - Shinjiro Koizumi * 
"RT ""The block holding back the radical action needed to avert the climate crisis isn't technology or public opinion...It's the networks of lobbyists, public relations executives & advertisers who work every day to defend [the current] system"" in "
"""According to climate scientists, climate departure is 'the moment when average temperatures, either in a specific location or worldwide, become so impacted by climate change that the old climate is left behind. It's going to be hot all the time"
There was a gaping hole in the ozone layer when I was younger with global cooling being a concern then along came global warming and now we have climate change. Thank goodness the scientists know what they're doing because I can barely keep up with it all.. #COP26Glasgow
"RT It's Adaptation, Loss and Damage Day at #COP26 We must protect people and natural habitats from the worst effects of climate change. Learn more #TogetherForOurPlanet"
aT EWE: The science of attributing extreme weather events and its potential contribution to assessing loss and damage associated with climate change impacts. 
"Fossil fuels are poison. Not only poison to our atmosphere, land & water. Poison to our health. Poison to our politics & democracy. Poison to media. Poison to peace. From Russia to Canada & everywhere. The sooner we are done with them the better we will be. Hasten the day."
Australia's climate change policies are so disappointing. 
"No, because the time zones will all have to be rearranged. Do away with daylight saving time, and then run your life according to the natural cycle of day and night."
"RT Great to celebrate the #PromiseToThePlanet campaign today. The Scouts are working to raise awareness of the consequences of climate change, and encouraging individual as well as collective action to address it. #TogetherForOurPlanet "
"There's a lot more anger up here in Queensland about mixed messaging causing a day inconvenience for parents than calculated, deceitful messaging causing a lifetime of catastrophic climate change for their children"
"RT When people wonder what loss & damage means in a climate change context, it means tragedies like this. Malaysia needs to step up on climate adaptation and loss & damage, not just focus on reducing greenhouse gases. We ARE vulnerable. Some of us are more vulnerable than others. "
"An End to the Global Feudal Mob$ter and their Entropic (Ecocide, Homicide, Espionage, Offshore, Black Market, Warfare) Slave-Extinction Economics ... "
And you probably believe climate change is a real crisis. 
Little Baby Doge Little Baby Doge is a team of climate change activists on a mission to fight global warming. Website https://t.co/lIILPRaBYZ 
"It feels like a new genre, ""Reality Movie"" It exposes the climate crisis the way the Lorax exposed the stupidity of bottled water. It also exposes the importance of hair to appearance. * The snack $ under-plot is so good; how boldly being a grifter has no consequence."
"Due to extreme weather and for the safety of drivers, the is temporarily closing the DVP and Gardiner. All ramps will be closed. This is to help move any existing vehicles that are stuck and allow snow plows to clear the routes."
"There are many ways in which one can act. I would suggest everyone focus on their own lifestyle by reducing plastic consumption, eating cautiously, and reducing personal waste. Like this, I believe we would make great accomplishments in the fight against climate change."
"Governments around the world poured trillions into economy, urging people to spend. Biden's $1.9 trillion gift to oligarchs was the worst. Buying votes backfired -sparked runaway inflation that's made hard working folks poorer. Oh did I mention the impact of war on fossil fuels? "
Climate change threatens to destroy democracy and schools are the best solution we've got. A thread 1/ 
"Occupied basements are more expensive than above-grade space, account for more embodied carbon, and are becoming more prone to seasonal flooding. In a climate emergency, the rational decision is to ban occupied basements & underground parkades."
"""The truth has become fatal to the credibility of drug war dinosaurs equivocating their way to political extinction."" History: How a traitorous notion stalled mankind's most precious natural ally via @hemptodaynews"
"Reducing our dependence on oil is good for our wallets and the planet. The infrastructure law is helping states build EV charging stations, and I'm backing a bill to boost American manufacturing of semiconductors, which would help increase supply of EVs. "
"it's probably alot worse on the coast for sure but even it was still bad here for the TV to cut out alot today, the O2 took a hit too lmao it's pure mad it's going to get worse with this climate change"
"RT ""TVA must finally be held accountable for its misuse of ratepayer money and its abuse of the planet."" Check it out this oped from and I calling on TVA to stop prioritizing fossil fuels and seriously tackle climate and energy justice. "
"When climate scientists warned 20 years ago that extreme weather events in Australia would intensify, accelerate & devastate people's lives,their urgent call for action was grounded in care for us-to avoid the fires & floods that now wreak havoc across our country #auspol #floods "
"Can't keep watching, this story on flooding in Canada is just an addition to the never ending stream of catastrophes our earth is suffering. I honestly can't do any more to help slow climate change, it's not us, it's #China and #India and #Russia and bent Govs. #C4News"
Economics to prevent social collapse: Kate Raworth & Steve Keen speak to Extinction Rebellion UK. 
WHAT BRINGS YOU EVERYTHING TO YOUR PATHETIC ASS GAS AND DIESEL FUEL  fossil fuels are very important to bring all you buy including this phone dumbass 
"RT Do you have any remembrance of the total abject terror you experienced? Can you at least imagine? Usually you numb yourself at this point, as a newborn, wanting to die. READ BOOK #devolution #evolution #anthropology #extinction #Earth Pl 20p/157"
5:40 time mark - #CNN director Charlie Chester reveals the next Global Crisis that will be used to coerce society into political manipulation will be climate change. The mandates are illegal and politically motivated. #Covid19 #BuildBackBetter 
"The power of the sun, of the people and of politics. The climate depends on all 3. ""... we need you to be leaders. They are senators from a state that has seen the impacts of climate change significantly."" via @azcentral"
"Former Trudeau Environment Minister Catherine McKenna fighting climate change one unnecessary flight at a time. Oh, and she turned off comments from people not following her. LOL. Coward. "
"RFA CEO Geoff Cooper argues that allowing greater use of American-made #ethanol lowers pump prices, improves air quality and fights climate change. "
So they don't want to protect the farmers from catastrophic climate change. They are just using this as a way to get money. Got it.
Hey Progressives did this since 2015 in BC where they were warned about the unacceptable condition of the infrastructure in a diverted lake bed...what happened when the disaster hit? Blamed climate change. Works for arsons in our forrests too.
"RT California is denying fracking permits in droves, two years ahead of Newsom's proposed 2024 ban It's the first time that oil regulators have cited climate change in denying permits, a rationale being fought in court w/ @sfchronicle"
"It amazes me that these delusional anti-vax twits spew their disbelief and misinformation under their veil of Christianity and Patriotism- and yet they foolishly ignore that THEY'RE the ones dying. Believe yourselves into extinction, dummies. Science doesn't care. Me neither."
"RT If we are to avoid catastrophic climate change, we must transform our energy system from one that burns fossil fuels to one that is powered by 100% clean energy. "
"6/ As Paul Romer once said: A crisis is a terrible thing to waste. I'm sure there are many lessons we can learn from the horror of Putin's war on Ukraine. For me, at least one of them is this: fossil fuels = despotism & war. End. #UkraineRussianWar, #Ukraine, #ClimateCrisis"
