"Adapting to the pandemic would have helped with climate change too Reducing emissions by localizing economies and travelling less, especially by plane Which is why koch network hijacked the covid response with GBD Fuel usage dropped and the air was cleaner"
Maybe it's just part of some darkness I'm experiencing but I have genuine fears about the state of the world right now. Fascism. Imperialism. War. Climate change. Pandemic. Rising inequality. All of it. And to think some people's biggest issue is wearing a fucking mask.
the reason are many! but in no case is because of the jabs! carbonated drinks shoveling snow sport breathing to many times (WTF) stress of switching off mask mandates covid stress normal situation climate change putin fault parents fault energy price rising gas price rising 
Just keep an eye on what the sneaky bastards are doing behind the scenes to Human Rights legislation and jabbing kids whilst the lying Govt & MSM get everyone watching Ukraine and try to make you believe it's something it's not. Just like the fake virus & climate change.
"Wasn't Al Gore a ""prophet"" of climate change? No, he wasn't!"
Study of health woes in Puerto Rico after Hurricane Maria New study-found long-term health problems in Hurricane Maria survivors-underscores the devastating health impacts of climate change on communities of color @DrIanWeissman 
"Human-wildlife conflict, habitat destruction, limited resources, limited jobs, rising house prices, climate change, disease."
Interesting. With climate change tho that whole things gonna be a disaster zone
"Arizona is rich in biodiversity and home to more than 800 native wildlife species. But with the growing threats of climate change, we risk losing part of what makes our home so incredible. I promise as governor to combat the climate crisis and work to preserve our great state."
It's not about only Ukraine - it's about all wars caused by fossil fuels - RESOURCES WE NO LONGER NEED. #PeopleNotProfit
Just some of the highly specialized training that members undergo to benefit the people of in times of extreme weather events. See this grueling training firsthand in video: 
All major phone brands  my Google Pixel 6 Pro didn't come with a charging block either. Just the charge lead. Something about climate change and wasting less  think it takes the mick that they charge us more and give us less though. 
RT They are masking COWS now for climate change. I'm done. 
"Respectfully, ""converging with other threats"" is doing a huge amount of work here. There is no actual trend data. And once you start counting displacement in places like Afghanistan, after 40 years of civil war, toward the climate emergency, I'm not sure what wouldn't count..."
"Gonna take awhile, buy climate change, and fascism, will do this for us eventually. "
Unbearable to think it's our wreckless species that is responsible for that! #COP26 leaders! We don't need pretty words! We need drastic actions! Ban fossil fuels investment! Ban private aviation! Tax frequent flyers! Invest in green technology! @BorisJohnson
A Maryland family replaced their grass lawn with a native plant garden. Their HOA demanded they destroy it and replant the grass. They refused. Their battle has led to the passage of a new law that forbids HOAs in the state from requiring grass. 
Climate change is a hoax just like Covid. It's all about rape and torture of innocent children!
Unfortunately Climate Change falls through the cracks of any Government. This is because the voters will not see any benefit instantly and will likely be only felt once the next Government is installed. What we need is a plan that is agreed by all over much more than 5 yrs...
"toxic FOSSIL FUELS create 6000 byproducts: chemicals, plastics, pavement, cloth, etc = CANCER Use LESS toxic FOSSIL FUELS = Less CANCER Imagine & create EVERYTHING without FOSSIL FUELS. = No Oil Shortage "
"So the UK's increasingly authoritarian, antidemocratic & anti-free-speech Government is to ORDER teachers to 'avoid political bias' in classrooms - they do know colonialism, slavery, climate change, inequality, & Nazism are political issues, right? RIGHT? "
"Hydrology Paper of the Day @SaraAzadiiC on climate change in the Zayandeh-Rud River Basin of Iran: wetland remote sensing characterization using NDWI, NDVI, and land surface temperature; spatiotemporal trend analyses; and statistical relationships between temperature and dryness "
It's pretty simple. You can't keep breaking promises & ignoring literal extinction level problems and expect the people who will most be affected to be excited to vote for you or your party.
"With your help, we can #EndExtremePovertyNOW and ensure that the world's poorest are better prepared to withstand future shocks  be it another pandemic, a heartbreaking war, or the climate crisis. Our future can't wait. Join us and start taking action: "
"According to UNCCD, 90% of Earth's soil could be degraded by 2050. If soil extinction is not averted, we will lose the very basis of our food, water, & air. There is still time to avoid the worst if we come together to #SaveSoil Act Now:https://t.co/Nni7DvMYAO #ConsciousPlanet"
"Don't tell me that bold action to avert the climate crisis is too expensive while greenlighting the $778,000,000,000 annual Pentagon budget."
I can say and think anything I want. Climate change predictions have been consistently wrong
Floods are a side effect of climate change. They get worse as we keep failing to act fast enough. Morrison is trying to frame this as a freak accident that nobody could have predicted. #ClimateCrisis #ClimateActionNow #auspol #ScottyDoesNothing #ScottyTooLate
Russia's attack on Ukraine woke up the world to the threat of a nuclear plant's exposure to catastrophic fire. The climate crisis has put one of America's largest nuclear weapons facilities into the same kind of danger. We've got to #StopInvestingInDestruction now. 
Many birds were hunted to almost extinction for hats during Victorian era.
Thousands of dead starfish wash ashore on Pembrokeshire coast after stormy weather 
Santos reps in the Native Title Tribunal are seriously arguing that their massive coal seam gas project in the Pilliga will not contribute to global warming This entire project is insane. Shame on Santos and the Liberals pushing ahead with attempts to smash Gomeroi rights
Aren't most Europeans green - concerned about climate change? Where are they and why are they not willing to make necessary sacrifices to stick to their available sustainable energy? Reduce dependence on Russian oil/natural gas and help Ukraine?
"Visualiazing Climate Change - from a machine's perspective. A blend between #dataviz and #art, made with #deeplearning. Hope you love it as much as I do! #dataart "
"I don't know. Probably Oregon, but they're under siege from fires. Climate change is a beast. I think I would definitely have to move north."
"RT Climate change is a ""huge threat"" to humanity and it is very important for governments to take action as quickly as possible, Italian physics Nobel prize winner Giorgio Parisi told reporters on Tuesday. "
"Stunning and brave: anti-oil climate change protester zip ties himself to a goalpost at a Premier League football match, bringing a halt to the game. "
Carbon capture and storage is nothing but fossil fuel industry propaganda to allow them to keep burning fossil fuels. It's ridiculously expensive to the point of not being worth it at all. It's always been a complete scam. 
"RT The fossil fuel industry waged a massive covert campaign to deny the truth of climate change and to obstruct climate action. Now, House Oversight will dig into that crooked campaign. We lost a decade to fossil fuel lies and bullying, and they need to own what they did."
Turns out it was the wrong kind of wind due to climate change
"People that say overhead catenary wires are ""ugly"" confuse me so much. You know what's uglier than wires? Dying from climate change..."
Did I miss the words climate change on 7.30 Report? Must have!
RT Part of the deal with the Nationals in relation to Net Zero 2050 is that they have agreed to believe in climate change by 2040
"It's unnoticed by more people than just the premier, mostly because there is no climate crisis or emergency. It's purely manufactured BS by climate alarmists."
"This past summer has shown what the climate crisis means for BC moving forward. The should eliminate every single cent given to fossil fuel corporations in royalties and credits, immediately. We don't really have time for ""first steps."" #bcpoli #climatecrisis "
"RT Please join us for ""Decolonising climate change narratives on Africa"" to learn about African Knowledges for #COP26. 4 Nov. 45:30pm via MS Teams. Please check our website for more details and to register: @PriestleyCentre"
RT Salisbury Mayor and U.S. Senator Chris Van Hollen address the recently enacted Infrastructure Investment and Jobs Act in flood mitigation and climate change in Salisbury. 
No words. --> European Union Has Paid Russia $16 Billion for Fossil Fuels Since #Ukraine War Started. 
"""This is how we stop climate breakdown. But it won't happen on its own. Asking politely for the ruling class to act is not going to cut it. It will require an extraordinary struggle against those who benefit so prodigiously from the status quo."" "
"If we had listened to Jimmy Carter in the 1970s, America could've been the world leader in Green Energy. This would have greatly helped curtail Climate Change, stopped our Russian & Middle Eastern enemies from getting rich, and possibly avoided many disastrous wars. Tragic."
"Fighting climate change will not only help in preventing natural disasters but it will, in the long-term, improve the quality of life of our citizens, help tourism as well as protect businesses. #EPPLocalDialogue "
"Finnish Extinction Rebellion () and activists are still blocking a train carrying Russian coal, which accelerates climate catastrophe and whose profits maintain Putin's war machine. Full support! "
Farts being responsible for global warming sounds more reasonable than IPL being blamed for Ashes loss #Ashes Root 
"When you understand even a portion of the scale of the consequences of climate change, you quickly lose all patience with high-profile climate deniers and climate misinformation."
"That's after 14 years of cuts and austerity already, and with a vast national debt, huge personal debt, and no national assets left to sell off. Plus climate change to pay for. Something radical needs to be done to give the economy a kick."
"This is something I am very worried about. Climate change is causing more frequent disasters and disease outbreaks. In response, the rich and powerful will continue to normalize higher and higher rates of death and suffering. We must speak up now. "
"BREAKING: The D.C. District Court revokes a decision to offer 80 million acres in the Gulf of Mexico for oil and gas leasing, marking a pivotal victory in the fight to defend Gulf communities and the planet from the worsening climate crisis. "
i dont support extinction but this is one thing i think we agree on... force users should not be trusted!
"Today, in a full page ad in the organized by joined 24 other leading businesses across the economy calling on the federal government to ACT NOW on the climate crisis. We have the solutionsand no time to waste. "
"RT Buy less plastic & reusable shopping bag.Use long-lasting light bulbs,Energy efficient light bulbs to reduce greenhouse gas emissions.Volunteer, educate, conserve water & plant trees. #FridaysForFuture #fridays4future #ClimateAction #ClimateStrike #SDGs #climate "
"9. Ecosystems are collapsing or on the brink of collapse around the world. This is due to destructive industrial agriculture, mining, construction, insect-killing pesticides, etc. Only degrowth may limit the damage as global warming intensifies. Thread:"
"Can someone ask Horner about climate change or another pressing issue? The man has all the answers, let's put him to good use  "
"RT Tomorrow at #COP26 and announce new Systematic Observations Financing Facility #SOFF, which seeks to plug weather and climate data gaps, support #climatechange adaptation and boost resilience of vulnerable countries to extreme weather #TogetherForOurPlanet "
"No obituary for Earth: Scientists fight climate doom talk. As UN releases gloomy IPCC report, scientists say curbing global warming not hopeless. By w quotes by & others "
I use it to light my wood burner..just doing my bit for climate change as well..double whammy 
"If we want to solve problems of climate change, migrants, dictatorships, corruption, human rights abuses, animal rights abuses, we need to ensure communities can be self-reliant and mechanisation. #water #heath #education #food #capitalismkills "
"Awful! Unqualified hunter & angler Martha Williams has been confirmed to lead the #USFWS. 15,000 IDA supporters opposed the nomination. Countless animals will suffer & die. #Extinction #NoTrophyHunting #ProtectWildlife "
"RT Most fossil fuels must stay in ground to limit climate crisis, scientists warn "
"I wonder what we will all be falling out about next year. I suppose there's loads of mileage in global warming, climate change, crisis, emergency and there's always Brexit is suppose"
I don't care about climate change. That's the tweet..
"We regret to inform no, you can't have your own facts. Yes, there is a climate emergency, it's already killing people and worsening. Your privilege allows you to ignore your moral duty not to ruin the lives of others through your own stupidity + detachment from reality. "
"1/2 Climate change, stress of our ecosystems & Covid-19 should remind us that we urgently need to build recovery plans for developing new food security systems & decentralized food supply chains sustainable agriculture technologies focused on reinventing farming "
"The only place there is a climate emergency is in flawed climate models that predict armageddon in 100 years time. Reality is climate is driven by natural cycles, sun's energy levels and random events; not human activities. Good senator is following a disastrous political agenda."
#Bitcoin sucks resources from the world's most vulnerable communities. 
"""Seabirds are climate change prisoners. Our inaction makes us the executioners."" "
"Well, global warming is a bitch, and so is mother nature"
"Exactly. There is no way the climate can change without the help of man. There was never warming or cooling periods before the industrial revolution. We never had floods, wildfires, tornadoes, hurricanes, etc...only man can cause them."
"RT A long-brewing crisis caused by drought, war and poverty has now been accelerated by the Taliban's shock takeover in August. The militants' resumption of their Islamic emirate has been accompanied by a suspension of aid and now economic collapse "
"See Jim stoke fear, hate & division. He does nothing to address the real issues facing Americans: wealth inequality, outrageous healthcare &education costs, inflation, climate change, gun deaths, etc. He's as useful as bucket full of holes. Vote him out."
"I've noticed after self isolating during Covid, the climate change fear porn is back. Everybody panic!!! "
Greens missed their own climate change target - ironic! 
From and Alaska is on America's front lines of climate disruption. 
I don't think it matters if it's climate change or a natural phenomena if shit is hitting the fan it's still hitting the fan 
"RT ""Calgary councillors vote to declare climate emergency"" The vote was 13-2. Calgary is run by climate fraudster fools. "
"14. Fossil fuels have made our water far cleaner. (Pages 49, 58, 93, 110, 359) "
"Please understand there's no stopping climate change without addressing policing, without addressing capitalism, without addressing white supremacy and ablism and patriarchy. The ways we seek to make the world a better place aren't just interconnected, they're one big fight."
"I give up: what extinction? We are no where close to an extinction level event; yet these people want to cause pain and suffering so that you will ditch your car and buy a $55,000USD Tesla. #ClimateAction #ClimateCrisis #ClimateEmergency "
Too bad you are a science/climate denier and vote against anything that helps US transition away from fossil fuels.
"#OECD Delegation visits #INRAESIA2022 stand: our collaboration, our research in economics & our scientific expert reports. 3 examples of our research adapting viticulture to climate change global changes & water and soil resources in the Mediterranean wastewater treatment "
Climate change is not an extinction level threat. Nuclear war is.
Reporting on fossil fuels without mentioning their consequence (climate change) is about as toxic as reporting on climate change without mentioning its cause (fossil fuels)
it seems more that the left mixed together the fear of climate change with a general fear and disdain for everything and so specific actions to stop climate change have little impact. they dont see it as a problem to be solved but a symptom of bigger problem which is capitalism
Don't forget to submit your response to the and Climate Crisis Survey. #pwclimate 
"Blink twice if you're in trouble twitter person, this isn't like you to support global warming "
" you probably also think that COVID was an accident, that the elections were legit, that global warming is real and there is systemic racism in this country"
Activists are fighting the EACOP pipeline that is planned to cut through protected areas and worsen the climate crisis. But that's not all: the pipeline is also threatening land rights of communities in Uganda & Tanzania. Time to @stopEACOP! @vanessa_vash 
them: there's no hope of stopping global warming now me: 
"Climate change denial, general lying and obfuscation, misinformation, bollocks, hard act to follow is Lawson"
"#IPCC scientists warn climate change losses becoming 'difficult to avoid': *Scientists say climate-driven losses will surge without action * Risks already evident, from Madagascar to Bangladesh *Richer countries not immune "
"Republicans plan to block Biden's Fed nominees including Powell. That's OK. Sarah Raskin is a climate alarmist and inside trader. Lisa Cook is a standard issue progressive/globalist elite. Brainard's OK, but she's a hostage until this gets sorted out. "
"I remember a couple of.months ago when the covid b.s. was starting to fade. Some people predicted the climate ""crisis"" would be back in the limelight. They couldn't have been more correct."
"Every issue. If you believe in AGW, you have to support the Green New Deal. If you think student debt is a problem, you have to support a bailout. Even on Covid-19, I still remember when they screamed that it was irresponsible to open beaches or schools bc Ppl are dying!"
He won't come to your house to recycle or put solar panels for you. Climate change solutions are a form of discipline and responsibility starting with the citizens including you. The same way you tell us how to take care of our health.
RT Threatened with deportation for wearing the extinction symbol. 
"Climate change is causing droughts and hurricanes, increased lightning strikes -fire risk, political - social - economic problems. It is urgent to do more to hinder climate change; otherwise, there will be serious repercussions on public and national security. Stop global warming"
"Look on the bright side, that program you created to keep black men in prison longer so you can use them as free labor to fight forest fires is helping people avoid getting Covid in the prison they are only forced to be in because of you."
Look what happens when you tell our enemies the main threat to the world is climate change. These are not serious people. They are morons
"RT Fox News contributor Lisa Boothe called climate change a ""limousine liberal issue"" after President Joe Biden assembled an 85-vehicle motorcade to Rome during the #G20 summit. #JustTheNews "
"RT encouraged vote leave to break electoral law. He's also a member of the dark money funded GWPF, who spread misinformation about Global Heating. He's completely corrupt. "
That's Hawaii??? Looks like ole Trump was right about climate change being a HOAX 
"Meet the 2022 #PassTheMic opinion writers group. Expertise across tech, teaching/education, anti-racism, public health, journalism, arts, feminism, migration, climate change and international development. https://t.co/Biep3UmR4D Really looking forward to working with them all "
"We're likely to see recommendations to the for two of these projects in the next fortnight. If NSW is going to meet its climate change goals, they have to stop these mine expansion projects "
Within the framework of the continuous response of the in the face of climate change and work to preserve and renew forest wealth; Red Crescent volunteers in the Wilaya of Saida participated in a large afforestation campaign in the village of Barbour 
Fighting climate change through public service and supporting American competitiveness with 1000 diverse new leaders - awesome! 
3 DEGREES OF GLOBAL WARMING QUITE PLAUSIBLE - TRULY DISASTROUS - Rapid emission cuts can reduce risks but not eliminate them The Economist 24 July 21 #UprootTheSystem #FridaysForFuture #EndSARS #StopEcocide #StopMethane #RepairNaturesArteries 
SMH article TODAY ! CSIRO study proves climate change driving Australia's 800% boom in bushfires - WHAT ABSOLUTE LYING BULL SHITE !! 
"I think what I loathe the most about our current disaster news cycle is the unqualified use of we WE are in deep trouble, WE should have seen this coming, WE should have stopped this, WE did this to ourselves doesn't matter if it's about COVID, climate change, or fascism."
A technology exists that can solve the climate crisis within five years. 
"The faith groups also said overconsumption was the key driver of climate change, pollution, biodiversity loss and ecosystem degradation. "
"This is prairie land for buffalo. Not made for farming. With global warming, and the destruction of prairie grasses  this is a future dust bowl. Have we learned nothing but greed? "
"Climate change is an adults problem to solve. How depressing it must be, growing up in a world, full of negativity and impending doom."
"AND THAT IS WHY THE YOUTH ARE #ANTINATALISM. We didn't choose this miserable life and we will not be forced into handing this waste bucket to offsprings who might die before the age of 18 either to malnutrition, SIDS or CLIMATE CHANGE. "
It is abhorrent that the MSM in the UK are wilfully failing to report on position on the Russo-Ukranian crisis. Russian tanks are spewing hundreds of tons of carbon into the atmosphere - this is no time to sideline the world's most renowned climate expert.
"If climate change is such a threat, why is Obama buying a Hawaiian oceanside mansion?"
"RT Xi said we need to deepen cooperation between the Belt and Road Initiative and the Eurasian Economic Union, support the innovative development of the digital economy, jointly tackle global climate change, and promote social and economic development in the region. "
A shameful decision which will do their brand no favours. Relocation to a car-centric retail park well out of the town centre just gives the impression that they couldn't give a fig about their loyal customers or the climate emergency. They should reconsider 
It's because they cannot find jobs in Brazil and other countries in South America. It's from climate change.
and if not for climate change downed wires would not break out so often in huge fires.
RT Many North American colleges that divested from apartheid in South Africa now have active students movements to divest from Israeli apartheid & fossil fuels. #BDS #ClimateJustice Boycott and divestment are time-honored tactics for challenging injustice. 
"Right on man! Tripling resource extraction over the next 50yrs , plastering the planet with windmills, toxic solar panels and poisonous batteries in the name of controlling climate change, Idiot climatetwits!"
"The message of the most recent climate change report? Delay means death."" breaks down a few of the most urgent and important ways governments need to adapt if they want to manage and avoid more climate-driven catastrophes.  "
Oh you mean the energy independence we have been wanting for years and you have been fighting against coz all the GOP wants are fossil fuels. They can't believe in a world without them. We are literally waiting for additional charging stations in order to buy electric cars.
"Planting in desert areas makes an important contribution against global warming and lowers the surface temperature from up to 70C to as low as 25C. Insects, birds and other animals gratefully accept the new green oases in a short time. Every plant counts. "
Bay area got LA weather now i fucks wit global warming 
That it spits on the raging inferno that is climate change and it does nothing for the most disadvantaged Americans
"UN Sec-Gen: ""Climate activists are sometimes portrayed as dangerous radicals. But the truly dangerous radicals are the countries that are increasing production of fossil fuels. Investing in new fossil fuel infrastructure is moral & economic madness pls note "
Worse than now... wait till scomo and his band of morons get back from their G7 conference and the climate change crap fest
We will not defeat climate change if mass transit continues to be underfunded and thus inconvenient or worse useless for commuters
It's belief. Alarmists believe normal weather events that have always happened (and always will) are evidence of climate change caused by CO2..that's an opinion of the anxious.
"Climate change is a threat to human health, driving diseases like cancer, asthma, heart disease, and mosquito-borne diseases like dengue https://t.co/BkliqlrN8L #HealthierTomorrow "
