"Canadians are suffering under a government of control. The Liberals want to phase out fossil fuels, so they punish Canadians who use gas. They want to curate what speech is heard, so they censor it. They don't want truly free Canadians because you can't control a free people."
"To solve the problem of climate change, we must first find out the real cause of what triggers these processes and why they are so destructive!  https://t.co/rw2z3X7OH5 #NotAGW #CO2hoax #CO2scam #CO2theoryDebunked #CO2SCAM #DestroyTheTheoryOfAGW #CO2exposure"
", east rand yona ke mess when coming to weather! Always extreme."
RT Statement: Environment Minister Sussan Ley should reject a proposal for a huge open cut metallurgical and thermal coal mine in central Queensland because it would worsen climate change and hasten the destruction of the Great Barrier Reef 
"In the short term we have to try to prevent this crisis from creating an economic catastrophe, says RMI's But there are also longer-term steps we need to take to reduce our underlying energy vulnerabilities."" #RussiaUkraineWar "
"HERE in Alabama, we've been getting warnings about a LARGE GLOBAL WARMING EVENT, as well!"
What does Amazon and police removing extinction rebellion protestors have in common? Next day delivery.
I'm not discouraging anyone from taking those little steps. I'm just reminding everyone that big corporations and imperialist countries must be held accountable because their activities have contributed so much to climate change.
"RT The number of assessed species on the is now 138,374 with over 38,500 threatened with #extinction. Discover more about their status and what can be done "
"In a disaster zone on the frontline of the climate crisis, the PM resorted to self-serving pontification | Katharine Murphy "
"How often those who deny the appearence of adversity are often lucky enough to never have to be affected by it with it in the first place. You could apply this to climate change, but also systemic issues such as racism or general scarcity"
"RT NEWS: Today, and took a critical step forward in our fight against the climate crisis by reining in methane from new and existing sources in the oil and gas industry. "
"In 1989 the UN said we had a decade to avoid dangerous climate change, they are still saying the same thing 33 yrs later. "
"This has been quite obvious for a long time. If one reads through value surveys and follows polling, the most divisive lines in western societies can be found through the climate action lense. It will be extremely bitter minority campaign to defend a ""way of living"". Worrisome."
"Acknowledging when you make a mistake is part of being a grown up. We deserve that much from our leaders. How else can we rebuild trust in our system? ""An environmental market without integrity is not an environmental market."" Powerful stuff. #auspol "
"The planet we think we're living on no longer exists. Go through this insane thread to learn about the 6th mass extinction, climate breakdown & ecological collapse, all caused by the destructive madness of corporate capitalism. System change required "
"The best threats to manipulate the masses are invisible. Terrorists in the ME, viruses, climate change, etc."
"RT Has Western style democracy now failed? Election to office is by the people for the people. We now have examples in America, Australia, Canada & New Zealand, where no citizen body was asked to vote on the fake climate change narrative. Inept leaders failed us & so has democracy."
"Animal gifting adds to the devastating domino effect of events that are correlated with exacerbating the climate & ocean crisis. Gift seeds, trees, water irrigation systems. #StopAnimalGifting @oxfamgb #holidaygifts "
How Climate Change Threatens Arctic Sea Ice and Polar Bears 
"""This is really where hunger, economic crisis and the climate crisis collide."" is in Jawjan, #Afghanistan, where families are struggling to access safe water. Please sign the petition. Let's call on the UK Government to #SaveAfghanLives "
" Please declare a climate emergency at State of the Union. Get PBS ""Earth Emergency"" documentary, or equal, out to the public. Pay to play it on OANN, Fox, etc. Superbowl ad for climate emergency & legislation. 2/2"
"I'll try BCGreen next election. Horgan has been terrible. Disappearing to Nova Scotia during forest fires, allowing 800 people to die in a heat dome, Keeping DBH "
RT It's crazy how the weather in the USA can target specific airlines. Climate change is something else these days. 
Not too mention that our grand children will suffer at the hands of climate change as LNP gov does nothing but produce more destructive hot air!!
"Today, the #IPCC will publish the most important #ClimateReport on climate change and its impacts since 2014. It is fundatamental to highlight its findings. I will compile in this thread the best reporting that I find about it. Mostly English, con un poquito de espaol.  "
My issues with downplaying the need for longer duration storage are that a) I don't think large industrials (such as smelters) will move away from fossil fuels without it and...
"RT Steve Baker MP. Well we all know he is a climate change denier, and is the front man for Net Zero Watch. Which is really a front for his petrol head pals to continue to burn the planet. So no surprise that he's ok for big companies to shit in our rivers. "
"I rage when pundits on tv opine that we only care about $ matters. It's not just what Carville said, decades ago... For me, ""it's Climate catastrophe mitigation,Voting Rights, Reproductive Choice, Living wages, Treason, Insurrection, & Seditious Conspiracy"" "
RT Didn't British troops burn down 50 sq km of wildfire reserve in Kenya in 2021 alone? African pop growth didn't cause climate change. History shows that it was environmental destruction during european colonialism that caused the climate crisis. So the blame falls squarely on you 
"Rob Reiner said on MSNBC that winning elections is the only way to correct any of the other societal problems. Climate change, human rights, hatred. I don't know if I've ever heard it expressed so clearly."
It's so freaking cold!! The irony of global warming! That's why chump doesn't understand?
America was energy independent. Now they cancelled the pipeline with Canada and are forced to beg the Saudis and Russians for more production to get prices down despite climate change rhetoric. 
"RT Well, it finally happened: I was called a climate denier. Getting yelled at by actual climate deniers was honestly easier on my mental health."
Forest fires rage in nine of Argentina's 23 provinces 
"RT Whereas he appeared happy and relaxed during the 2019 election Morrison now looks desperate. He has told too many lies, and failed to deliver the promised Fed ICAC. He absconded during the 2019 bushfires, and he doesn't have an acceptable climate policy. He is on the nose in "
He won't even admit he was wrong about Climate Change and that he didn't invent the internet.
"More lanes means more cars means more emissions means more warming, and any politician who favors roadway expansion is fundamentally unserious about climate change. "
"White journos have the most access for environmental justice reporting; communities of color & Indigenous communities are the most violently impacted by climate change. asks: who gets to tell this story, and how will it shape the future? "
"No one nation can tackle climate change alone. It is the most significant collective problem we have faced as a global community, said John Kerry emphasizing that leads the way on how int'l orgs must focus on the security aspects of the climate crisis. "
"Kiros and Samrah are having difficulties eating even just once a day. Not because of climate change, but because the Ethiopian government refuses to allow sufficient food, medication and other aid into the region. Because it closed banking, electricity & communications in Tigray. "
"One of most frightening tweets I have ever seen Of course to most people its irrelevant - because if they realized what it means they would be on streets screaming,demanding climate action This will lock us into a warming that will be our worst nightmare "
"On Saturday we're standing with to protest greedy and callus policy that has limited the lives of the poorest Americans. It's time for Joe Manchin, and every politician, to put our priorities into policy. "
"The Prime Minister's negative campaign on climate policy does not appear to have cut through in a net-zero world, writes TND's #auspol "
Great to speak to about new report about Facebook pushing climate sceptics further down the conspiracy rabbit hole. Facebook insists it has systems in place to reduce misinformation 
"2. Five years ago, 20,000 scientists signed a paper stating that to avoid 'vast human misery' economic growth would have to be re-thought. The Intergovernmental Panel on Climate Change has niw indicated that 'degrowth' is one of our only remaining options:"
"So says it's unforgivable to forget the unemployment figure. Yet Liberal corruption, cover ups, misogyny, racism, incompetence, wage stagnation, unaffordable housing, declining living standards, global warming, and a lying, cheating PM can all be forgiven? FFS!"
"Biodiversity crisis, water scarcity crisis, air pollution crisis, climate crisis, and then there are the facts. "
It's a shame we need to rely on a billionaire to mitigate catastrophic climate change instead of our representative leaders. This is the world we now live in.
Why is this Mozilla thread so hated? Is it because they have all crypto? Is it because of climate change? Is it because crypto is a scam?
It's time we learn to live with cancer. It's time we learn to live with the opioid crisis. It's time we learn to live with climate change. It's time we learn to live with crime. Said no one ever. We are trying to minimize all of these. So why not do the same with Covid?
Climate Change CORRUPTION visiting another Criminal Government
"Thanks to covid, I now know there is no climate emergency."
Changing our government is the most effective way to help solve the climate crisis. Full stop.
.the future is renewable: There is no room for fossil fuels or #FossilFools. The best and most immediate solution to SA's energy & unemployment crisis is a #JustTransition to #RenewableEnergy. #StopShell >> https://t.co/eqqvBLoHd7 #ToHellWithShell .
"We're strictly non-violent, but we do harmless things like blocking roads to bring more attention to the messages we're trying to send. A lot of people call us walkers for blocking roads but I'm sure dying in a forest fire as the result of devastating climate change is more wanky"
RT Welcome to California This disgusting image is cause by oil companies! Pipelines need to be OUT of this world. To save our oceans we need to STOP using fossil fuels. ! STOP ALL OIL DRILLING IN THE OCEANS ! NOW ! 
FUTURE WE CHOOSE: SURVIVING THE CLIMATE CRISIS PRATIK DESERVES BB TROPHY #PratikIsTheBoss
More CAGW propaganda from the climate science denier.
"RT Kentucky & 5 other states get hit by devastating #tornados ! At least 70 dead, so far, in Kentucky alone!! Tornados in December is not Mother Nature! Its Climate Crisis! Will this wake up Repubs like #MitchMcConnell & #RandPaul, since they represent #Kentucky, to do something?"
"I feel like you're not anxious or depressed while global warming, covid, and a ton of other fucked up shits goin on you're either a bad person or something else is wrong with you "
"And I'll add, anyone writing or speaking about it without a strong grasp on human and planetary health and doing so under the guise of climate change only further perpetuates the problem and is not helping. You are part of the problem."
Humanity's failure to tackle climate change in the 1980s had many causes | Letter 
"So nice to see another fidgety old person with dementia. Nice to see you reassuring us that you will stop fossil fuels from lowering the price of petroleum products. As you rape the Strategic oil Reserve, Not Russia, Biden mistakes! Fuck your clean climate bullshit. Just died!"
TWELVE DAYS OF DICTATOR TRUMP: Tax breaks for the rich $8 trillion in debt Worsening climate crisis US a global laughingstock Slower mail delivery 55% more hate groups 3 illegitimate SCOTUS justices 800K dead Americans Desecrated US Capitol Building The end of democracy in the US
"5,555 Tigers who lived in fear of extinction, were in for a surprise when others started showing up! Now, there's another battle to fight! Humans https://t.co/dZYJo1QhIQ #EverestCoin #NFT #NFTs #TTigersNFT "
"Negative #1: When Carbon turns into CO2 and ends up in our atmosphere, it contributes to climate change, which causeswelllots of bad things to our environment and economy, which is why we need to ACT NOW to stop the worst effects and get to net-zero, then net negative. 14/20"
Just to play devils advocate here: One might argue adding more T-shirts to the world is almost as bad as burning fossil fuels. Wear what you've got and buy second hand when you need it.
"I seriously doubt it. Globalism, mass-migration and climate change were inevitable and Trump ran on a platform against that."
"Yes, the fake metaverse world. I fear humans (real humans) are going to be near extinction by 2035 if the sheep keep going along with all of this crap."
"RT In short, it's a scam, it doesn't work & the creation of a global #CarbonOffsets market will just delay real #ClimateAction cutting emissions while protecting and restoring nature. This means saying NO to offsets and YES to ending fossil fuels. #COP26"
Browse the LA Room at the UN Climate Conference! StreetsLA's cooling techniques are some of many being showcased. #ClimateAction #urbancooling #LosAngeles @Spottnik
"in times of climate crisis, rising temperatures, rising CO2 emissions, you want to add such powerful value to the global energy problem by calling it technology .. and I'm a moron ?  "
"Rebellion of One stories: 18-year-old Rod blocks a street in Copenhagen because ""politicians do not listen to science and do not deliver on anything close to what's necessary."" Her sign says: ""I'm terrified that war will come because of the climate crisis"" "
"Aged care, climate change, Biloela family, casual workforce, stagnant wages, black deaths in custody, Christian Porter, Craig Kelly, Clive Palmer , vaccines, lies, Hawaii ,rorts, turning back on women in Parlt are some of the reasons the LNP should be voted out @ScottMorrisonMP"
"ENDORSEMENT ALERT! I'm honored to have the support of a dedicated public servant like He works hard every day to help educate our kids, keep our community safe, and he has a plan for addressing climate change. "
"AGW isn't objectively true? Well, well. So it can only be subjectively true then. So it is a belief, not science supported by verifiable cause effect evidence. Now we are making progress. "
"That is to say that we should consider the possibility that by 2122, the effect of weather on human lives will be then a further reduction to 1/400th of what it is today, despite climate change. This takes us to a terrible conclusion..."
" blind those who would stand against me by posing as a direct threat to humanity. Immeasurable shame gathered the perfect conditions to release the uncontrollable storm wild within my gaze, fostering forest fires that burned the last wisps of dignity. How I ever find "
"It is useful for clean energy to be cost competitive. However, it should not take Putin's war crimes for capital to shift fast enough to support clean energy investments at a pace consistent with avoiding the worst harms of the climate crisis. It is still disaster capitalism. "
"RT Wonderful to be visiting the #Nigeria pavilion at the #DubaiExpo along with H.E Reem Hashimy, H.E. Mohammed Dansanta Rimi, Dr. Nawal, and other colleagues committed to climate action and an equitable transition in the lead up to #COP26. #SDG7 "
They'll find him. Arrest. $1 bail. Do it seven more times. All charges dropped. Build a statue in his honor. Media sucks his toes. Blame climate change. 
These sadistic geniuses are turning your home into a prison and a slavery plantation. Covid to climate change to implement artificial intelligence communism on steroids.
"I mean, the alternative is to scream bloody murder about it to the wind for a few weeks, at the end of which I will be exhausted and sad and climate change will still be spiraling out of control, so yeah, I was gonna ignore it instead of that. "
I was in London in January and prices were $8/gallon. It was all taxes to push the same thing Biden is pushing under climate change
Delaying the crisis Denying the crisis Ignoring the crisis Mocking the crisis Objecting the crisis Also means INTENSIFYING the crisis. It is already too late. Act NOW. #ClimateCrisis #ClimateAction #ClimateEmergency #climate #IPCC 
"#Climatecrisis : Delay means death: We're running out of ways to adapt to the climate crisis, new report shows. #IPCC "
"Earth is hurtling towards mass extinction. Aloy is headed west to discover why. Join her as she faces fearsome new machines, dangerous enemies, and striking characters across distant lands. Uncover the mystery behind the new collapse and restore balance to life on Earth."
"Every centralized institution is trying to launch their stablecoin. As the largest Dao, why can't the United Nations launch its own stable currency to solve the global hunger crisis, climate crisis, and regional conflicts?"
The polls in #Virgina are open!!  6am-7pm EST 11/2  If you want a $15 min wage  Pro-Choice  Climate Action  A believer in Science  and much more.  #VoteTerryMcAuliffe #DemCast #ONEV1 #DemCast Click here to find your polling place 
"there were 3 extreme hurricanes hitting his own country, the entire west coast was on fire, there was flash floods everywhere drowning people etc but it's just bad weather, corporations do no wrong- & top it off w the most misogynistic concept i've encountered in ages, perfection"
"RT Since 2018, Australia has lost approx 30% of its koala population, according to independent nonprofit Australian Koala Foundation. Conservationists are blaming the losses on issues related to climate change such as droughts and fires, as well as habitat loss from development. "
Michelle Wu recently participated in an illegal blockade of a major bridge going into South Boston to protest climate change. She is now banning protests in front of her house because she doesn't like what her own medicine tastes like. 
RT It's important to hear from those on the frontlines of climate change. are you listening? Stop funding the climate crisis. 
Someone has to play the scapegoat to make sure we don't get what we need. What was promised as long as we voted for that one person. Vote here and you'll get$2000! Vote for this and you'll have$15 minimum wage! Give us this and we'll fight climate change! Ha.
"Keep pushing the click bait cherry picked fear numbers poll, NPR. You forgot to add COVID and catastrophic global warming scare. Step your game up."
Catastrophic floods that swamped British Columbia last fall were made twice as likely because of #climatechange https://t.co/AUIZyQZtNI 
"Quick, turn global warming back on, it's cold as fuck! "
RT Minister wants to grant a licence to Flintridge Resources to prospect for gold and other metals in North Leitrim. This would pollute and destroy ecosystems and make NO SENSE in a climate emergency!!! Here's why & how you can easily help (please RT): 
this is what the democrat oil lobby is doing to our america! no more fossil fuels! 
I really struggle with the Morrison + Perrottet Government's blind spot (ie ideology) on the economic benefit of good public health policy. But then I shouldn't be surprised given similar blind spots stop our conservative govt acting on climate change + investing in basic science
"If all nations make decisive, immediate efforts to slash carbon pollution, we can still limit global warming to safe levels. We've got everything we need to meet this challenge. It's simply a matter of making the choice to give it all we've got "
"Too many Brit's believe the anti-renewable energy propaganda from multi-billionaires with investments in fossil fuels. #SolarTechnology CAN provide ALL the #electricity we need in the UK; #solarpanels are now efficient enough to work in fog, rain, snow, etc & CAN power at night. "
"""Although climate change is fake and not real like in our 10 page spread last week, can I just shock you?"" - By Fraser Nelson"
"RT There are enough things in this world that are killing people... guns, climate change, inequality, COVID 19, totalitarian governments... music shouldn't have to be on this list."
Climate change again no doubt. Can't be anything else now can it
RT Excellent review of how has Australia playing a key blocking role to progress on global climate change. says Santos's business model has come to be all about harvesting government subsidies. 100% true! 
They said Covid was a hoax. They said Russia would never invade. They say climate change is fake. They say vaccines don't work. They say the news is fake. They praise Putin. They attacked the Capitol. They ban books. 
Extinction? Are you going to deny the fact that not all heterosexuals want to reproduce or even those who want to some of them can't?
"Glade to meet Minister for environment and climate change with Villingili Council team. Discussed about the current situation on Villingili resource recovery & waste management center, renewable energy, water & sewerage, shore protection and flood control. "
I was promised global warming but all I got was more taxes.
jsyk when climate change gets rolling everything will be phrased like this. make yourself acceptable for work or die/ starve/ catch plague/ drown in encroaching seawater/ burn/ get eaten by mutant mosquitoes. work or die. work or die. work or die. work or die. work or die. 
"Tree of the week no.1 London Plane on Jesus Green. It stores over 4000kg of CO2. In the midst of mass extinction, we must treasure and protect what we still have! @CamCanopyProj more info on this beauty here "
The plus side of an early climate crisis is we all die hot & young(er)
"This points to our own Energy Policy corruption, imo Yes, it will take time to migrate from emissions-based energy resources...but per VERY severe risks due to Climate Change, we absolutely NEED to migrate away from emissions-heavy energy options ...and I fully believe non-Grid"
"It is time to find out the truth about what is happening on the planet, what climate change is happening and will continue to happen. How we can survive. And we can survive if we build #CreativeSociety "
"""How to find #hope in the face of the #ClimateCrisis spotlights Grannies for Future, #climate lawsuit success, GenZ intersectional #environmentalism, indigenous leadership, & global interconnectivity. "
"Scientists have made the most detailed observations of Venus' equatorial nightside winds, which are connected to the planet's greenhouse effect.  Read more about how these winds offer clues to Venus' greenhouse: https://t.co/ig6Dv9kKly  ESA/ JAXA/ J. Peralta/ R. Hueso. "
The GOP Denying Climate Science Reality Of Climate Change 
"Thank you to Administrator and the Biden Administration for prioritizing the health and well-being of our families, communities, and planet and for taking action to combat the climate crisis that is wreaking havoc worldwide. There's no time to waste. (3/3)"
"RT #LetsTalkClimate: we're having 2 different climate convos in this country. In French, leaders are asked how they'll get Canada off fossils and how they'll meet targets; in English, about pipelines as necessary to the transition (!) and whether climate change is real #elxn44"
boring movie with a surface level commentary of climate change sleepppppp
"In the Atlantic Forest, the lowland tapir is at risk of extinction via @PalmOilDetect"
"The overwhelming majority of people r not equipped to handle this era in history - the rise of violent fascism, the escalation of the climate crisis, the never-ending pandemic. We lack collaborative leadership & many people w basic common sense. Our future is challenging."
"Biodiversity/organic farming etc, fine objetives but by no means more important than global hunger, have ""hitched a ride"" on the climate emergency crisis. Faced with an oncoming global food crisis, we now need to reverse those decisions. 18/ "
"Our latest fact sheet examines how the impacts of climate change interact with political, social and environmental stresses to compound existing vulnerabilities and tensions in #Iraq  "
"No. No. Please, stop it! Yes there is some offset at the manufacturing stage, but it is not as bad as some portray it to be. And during the lifetime that offset is compensated very quickly. And it keeps improving. Fossil fuels never improve. Ever. And their fumes suck."
"Today, and I spoke about Russia's illegal invasion of Ukraine, the need to end this conflict, and the importance of respecting Ukraine's sovereignty and territorial integrity. We also talked about pandemic recovery, climate change, and other global issues."
"Nature feeding the planet we call home, as deforestation reaches record levels in the lungs of the world, dangerously close to a tipping point of no return. Stop electing climate deniers! Demand Congress take bold action on our climate emergency! "
Are the Russians and the Chinese supporters of Western Civilization destroying itself do you think? Climate change has been happening since the beginning of time. 
"IMO, it's a mistake not to do everything we can right now to safeguard democracy and mediate climate change for the fear that we may lose an election in a year. Inaction has far greater negative consequences for progressives than action - always. "
