index,text,label_text,label_code
925,"RT Her whole piece is just glorified concern trolling, though. She doesn't actually care about reducing GHGs or tackling climate change. She's just trying to throw sand in the gears of the energy transition, like so many other bad-faith actors right now. Don't let them. ",Slightly agree with climate change,1
926,"I can't bear this state of constant disaster porn the media is engaging in. We can never just have some equilibrium of normality. There's always some world ending crisis- Covid, climate, WW3, enough!",Strongly disagree with climate change,-2
927,Droughts are actually decreasing. So much for that climate conspiracy theory... ,Strongly disagree with climate change,-2
928,We're proud to be a part of the movement who are hearing the voices of everyday people who want action on climate change! Together We Can are sharing climate stories from everyday Aussies & taking them to Canberra to present to the leaders of the country! ,Slightly agree with climate change,1
929,CLIMATE CRISIS : Hotter weather will get worse Colder weather will get worse. any questions ?,Strongly agree with climate change,2
930," ""With all the things going on the world right now, it is the mark of a true extremist  as members of Extinction Rebellion are  that even now they will not alter their demands"" | Writes Douglas Murray ",Neutral to climate change,0
931,"Dave Suzuki says it may be time to use violence to interrupt the oil flow if nothing else works, very radical, but if it is extinction level shit perhaps justified. Webo Ludwig was ahead of his time?",Strongly agree with climate change,2
932,"Humans cannot control climate change, they must adapt to it. There is no climate crisis or climate emergency. ",Strongly disagree with climate change,-2
933,"""It's global warming, we should stop cutting trees!"" ""B-but you are an ARMY"" ",Neutral to climate change,0
934,"RT At least 33 activists were arrested for blocking traffic on the FDR this morning as they demand Joe Biden's use of executive orders on climate action. While Extinction Rebellion is more known for direct action, this protest also featured a collaboration with ",Neutral to climate change,0
935,Looks like climate change will take on a whole different meaning now!,Neutral to climate change,0
936,RT It's pretty obvious from watching this prosecutor going after Rittenhouse that he's a smarmy lib- This guy probably worships Fauci and double masks between sips while he drinks his oat milk latt outside crying about how climate change will eradicate humanity,Strongly disagree with climate change,-2
937,"RT Joe Biden failed to even utter our greatest national security threat by name today: China. While he bows to China on climate change, they're committing genocide of the Uyghurs, suppressing Hong Kong, threatening Taiwan, and covering up COVID-19. He's weak and they know it.",Slightly agree with climate change,1
938,ITS THE SONG THAT NEVER ENDS! Well it will when we all die from climate change... ,Strongly agree with climate change,2
939,"A renewable revolution, home insulation, and low carbon heating. This is how the UK government can improve our homes and tackle the climate crisis. ",Strongly agree with climate change,2
940,We're in trouble because climate change deniers refuse to budge. Same as voting rights deniers refuse to budge. These self-serving deniers are driving me nuts. ,Slightly agree with climate change,1
941,"RT Extinction Rebellion protesters have dumped a large pile of dung outside Finance Minister 's office, declaring that Cop26 was a ""shit show"". ",Neutral to climate change,0
942,Buffoon in a Typhoon. And an RAF P8 Poseidon anti-submarine aircraft was flown to Lincolnshire - where unsurprisingly it found no subs lurking beneath the fields - out of service for 2 days - for this Boris photo stunt. ,irrelevant or no opinion on climate change,99
943,"Coal executive or oil executive? No, wait, climate change denier.",Slightly agree with climate change,1
944,"Seriously? Claiming the title of ""medical researcher"" gives as much information as ""Climate Change"" Does she take different brands of aspirin and then note the color of her stool? Well that would constitute a ""medical researcher""!",irrelevant or no opinion on climate change,99
945,"There are over 1300 active volcanos and a sun 10s of thousands of degrees just aching to throw solar flares at earth, climate change is real and humans have no control over it. So tell the left to stop stealing tax payer money to pretend they can do something about it.",Slightly disagree with climate change,-1
946,"Climate change is a catastrophic failure by governments. But we are voters, and governments act on our behalf. Many of us are drivers, flyers, meat-eaters. Morally speaking, we can share responsibility for harms we are part of between us. ",Slightly agree with climate change,1
947,Mr. Mikey says he is against the use of natural gas and fossil fuels. Call his office at 202-224-5852 and ask if he has turned off the gas to his own multi-million dollar home or if he is just a lying hypocrite who wants others to do as he says and not as he does. ,Neutral to climate change,0
948,"""The head of CIA warned Russia about the consequences IF they are behind the Havana Syndrome."" How about warning him in response that he will personally answer if CIA is behind the disappearance of marsupial wolves and the Global Warming ",Neutral to climate change,0
949,"#climatecrisisfatalities EWE: Climate crisis: 11,000 scientists warn of untold suffering. ",Strongly agree with climate change,2
950,"Amid a global biodiversity crisis, the story of the vaquita shows how even obvious solutions like stopping illegal fishing require political will, enforcement and deep engagement with local communities. ",irrelevant or no opinion on climate change,99
951,Our has adopted the awful commercial format of interviewing some random bloke in the street for his useless opinion. This one was probably screened to make sure he had no idea about our climate emergency,Strongly agree with climate change,2
952,Guessing the 'climate crisis' has a similar breakdown in demographics.,Slightly disagree with climate change,-1
953, Tune into x latest podcast episode discussing why the conversation on loss and damage caused by climate change has never been more critical. ,Strongly agree with climate change,2
954,RT Learning to see the world as whole and interconnected is a climate change adaptation.,Neutral to climate change,0
955,Wear handgloves honourable it is cause by climate change,Slightly agree with climate change,1
956,I don't care if this is the last time I'm ever booked on corporate media. The climate crisis is an emergency that threatens us all - and everyone should be using whatever megaphones they can grab to sound the alarm. ,Strongly agree with climate change,2
957,"RT The climate crisis is already having devastating consequences for British Columbians and their communities. We all experienced this first hand this summer, over 1,000 dead from a heat wave and millions choking on the smoke from yet another record breaking fire season. 2/ #bcpoli",Strongly agree with climate change,2
958,Get the vaccine or get fired. A infrastructure bill that will have no effect on anything. Pushing a climate change agenda that had no real evidence to back it up . Increase in taxes. Putting us in dump policies. Putting us back with OPEC and bringing back the swamp,Strongly disagree with climate change,-2
959,"https://t.co/I3oMXDYFyS Would you like to fight man-bear-pig with me? It is the cause of global warming (""I'm super cereal right now"") I know you're sensitive.",Neutral to climate change,0
960," Yep, we took my climate killer out cruising around yesterday. It was 84F while we were out and about, this morning, it's 31F. Damn climate change went the wrong way ",Neutral to climate change,0
961,"...or for Russia, China, climate change fascists, the Great reset, and the Biden crime family.",Neutral to climate change,0
962,"There is no excuse for the Climate Lies perpetrated by the IPCC, Trudeau, & the UN\WEF\Davos Gang. All of Canada was under up to 3.3KM of ice just 21,000 years ago & it all melted with stable CO2 & no gas engines by 5000 yrs ago. That was climate change. ",Slightly disagree with climate change,-1
963,"RT I went to #COP26 to tell the truth about the connection between human rights crisis and climate crisis. Without basic human rights, we won't succeed. It will only get worse if we don't defend absolutely basic things. ",Strongly agree with climate change,2
964,RT How might we avoid a global extinction tsunami at horrific 1.5C - 2C from 2029? ,Slightly agree with climate change,1
965,"A marvellous Start the Week today', with some new information (for me) about finds at Stonehenge, the history of extinction, what Nature does for us & the future. A great collection of related themes, intelligently discussed. More of this please.",Neutral to climate change,0
966,"Trouble is, where does it end. He gets more weapons, Russia uses stronger weapons, he gets more weapons, Russia uses stronger weapons. Meanwhile, Ukraine is reduced to rubble, thousands die, & so it goes on. Escalation to the point of extinction, is not the most sensible strategy",irrelevant or no opinion on climate change,99
967,"2.Reject every liars who frantically justify their defiance against climate crisis without showing any evidence. They just stick to their temporary, finite benefit. They are nothing but pests; the parasites which hurt the Earth without producing any benefit to the other life.",Strongly agree with climate change,2
968,"RT In Kenya, there are 1,400 native tree species, of which 10% are threatened with extinction.We are working withcommunities andpartners toensure that none of Kenya's tree species become extinct. ",irrelevant or no opinion on climate change,99
969,"This is fucking evil. Angus Taylor is committing a heinous, murderous act. Expanding fossil fuels in 2022, with the climate crisis in full swing, killing people across Australia and beyond, is truly evil. My anger could power half the country right now. https://t.co/3C8SBvSLQS?",Strongly agree with climate change,2
970,Scientists analysed both common and rare species and found billions of regional or local populations have been lost. They blame human overpopulation and overconsumption for the crisis ,irrelevant or no opinion on climate change,99
971,Climate change denial making it worse. Apr 24 EWE: Climate Crisis - United States Catches Fire 2022 Fire Season Looking to Burn it All Down With Us inside. ,Strongly agree with climate change,2
972,"If the flood protection system suffered no damage from such an extreme event, then it would probably be overbuilt - like driving an Abrams tank to work to improve collision safety. For truly extreme events, it is more important how the system fails than having it not fail.",Neutral to climate change,0
973,"According to in 2021, natural disasters caused overall losses of US$ 280bn which is around half of the annual global investments in combating climate change ",Neutral to climate change,0
974,2. The IPCC is finally considering degrowth. Tens of thousands of scientists warned of 'vast human misery' without a rethink of economic growth to deal with ecological destruction and abrupt climate change in a major paper 5 years ago. Threads to explore:,Slightly agree with climate change,1
975,Have you tried using a reusable straw to combat climate change? I think that's how we will solve the whole crisis.,Strongly agree with climate change,2
976,Once again I am proud of the reps of my date. McCarthy is so concerned about the 2% of fossil fuels from Russia (yet he will turn around & complain about gas prices right after) yet is silent about his party backing Putin. #GOPTraitorsToDemocracy #BlueVoices ,Strongly agree with climate change,2
977,"Most ppl I talk to say some variation of ""it's depressing/bums me out."" Hey, they aren't wrong - it fucking bums me out too. The feelings of powerlessness and grief are hard to combat re: climate change. :/",Strongly agree with climate change,2
978,"It's over. The bad guys have won. Not just here, everywhere. Climate change, tax, cost of living, MPs continue to fiddle, wars, Brexit, right to protest. It's over. Its sad. We've lost. The best thing we can do is stop bringing new children into this utter horror show of a world",Strongly agree with climate change,2
979,Thanks for all you do to educate us on the global impacts of Climate Change. That is one powerful group you are a member of and I am honored to know so many of you.,Slightly agree with climate change,1
980,"From a basement bomb shelter in Kyiv, Ukraine's Environment Minister said: For decades, we've been using limitless fossil fuels. This brought the rise of mad dictators with a lot of money to kill people and destroy the environment from #UNEA5 ",Neutral to climate change,0
981,Just letting people remember that climate change is real. Rebplicunts just gaslight and blame Chyna(Trumpaloompa's saying) for global warming and trade deficit. When on reality the US and China have the most CO2 emissions than any other country in the worldand are now physically,Slightly agree with climate change,1
982,I would like to write children's books about loss and suicide and climate change and novel viruses and the power of self acceptance and and,Slightly agree with climate change,1
983,"RT I find it absolutely insane that activists, normal people, and scientists - SCIENTISTS - have to fight to get media and government to treat the climate crisis as the unprecedented planetary emergency it is. It's utterly unforgivable.",Strongly agree with climate change,2
984,So I don't believe all this Tom Callow nicey nicey BS and accepting sponsorship from them and giving them credibility! FFS! Naivety! They are a business with zero ethics.. $'s talk.. ROI talks.. EV's and climate crisis are an inconvenience! Rant over.,Slightly disagree with climate change,-1
985,"No fossil fuels impacts: travel (ambulances), PPE, drugs, machinery, sanitizers. hardly stuff you need in the NHS",Neutral to climate change,0
986,War is what happens when language fails #HolocaustMemorialDay #MLK #GrenfellTower #BlackLivesMatter #BidenHarris #oprahmeghanharry #ReparationsNow,irrelevant or no opinion on climate change,99
987,"RED FLAG WARNING in effect through 8pm tomorrow. Strong winds, high temperatures and low relative humidity mean fire weather conditions will be very high to extreme ",irrelevant or no opinion on climate change,99
988,Uninsurable': Bleak outlook for once-idyllic riverside homes amid climate crisis | The New Daily ,Strongly agree with climate change,2
989,"RT Loss & damages day at #COP26 The Global North has a debt to pay to the countries most impacted, especially the US: historically responsible for the climate crisis & injustices across the globe. The 100B USD pledge is just a drop in the bucket of what's needed. #ShowUsTheMoney ",Strongly agree with climate change,2
990,Change will add to it. Why the big push not to try to limit our pollution. Nothing wrong w that. But blaming everything on climate change is disingenuous. Chinese and Russians don't care about Climate Change. I'd be more afraid of war.,Slightly agree with climate change,1
991,RT Anti vaxer and climate denier is the same slur by the same people.,Neutral to climate change,0
992,"Ik right, those silly Circassians were just so ungrateful for being ethnically cleansed and deported from their own homeland. Those Inuits really need to learn so manners too, it's not everyday that your people get to be slaughtered to almost near extinction by Cossack horsemen.",irrelevant or no opinion on climate change,99
993,"Masks are ineffective but damage the wearer physically and psychologically; the jabs are dangerous, unresearched, experimental, long term effects unknown; the evidence of warming is weak, of AGW non-existent, while predictions of disaster have all failed. So why stop?",Slightly disagree with climate change,-1
994,"Detroit: Become Human (no spoiler) 9 Stars: what a game. It puts you into the inevitable conflict between human and rise of the machines and let you make the ultimate decisions so we could live together, or die together. War or no war? Live or extinction? It's in your hands. 1/4 ",Neutral to climate change,0
995,RT The media desperately trying to avert attention from the probable cause of rising heart conditions in 2021 - everything from poor diet to climate changeit would surely take a rather sudden and aggressive change in diet or climate to explain the rise ,Neutral to climate change,0
996,"""Most Americans say Climate Change is a Crisis"" https://t.co/COYILUEE2J It is our corrupt leaders on both sides of the aisle that continue to destroy the environment on a grand scale--> ",Strongly agree with climate change,2
997,It's because the government are backing this climate change shit that the police will have been told to stand down. Anyone else blocking a motorway they would get dragged off to court.,Slightly disagree with climate change,-1
998,This story was eye opening. Exxon should pay big time to clean up the mess of promoting climate change as no threat to planet Earth. Is it too late to turn back the clock? Time will tell. I will be dead by the time the worst happens. So many places will soon be uninhabitable.,Strongly agree with climate change,2
999,A mission the world cannot fail: Author Kim Stanley Robinson sets out the enormity of the challenge in transitioning so-called petro-states away from fossil fuels. ,Strongly agree with climate change,2
1000,After 2 years of psy ops . The average American is now worshipping at the alter of war. The irony is that a full scale war with a nuclear armed Russia will usher in real climate change and real quick. Amazing how dumbed down people have become,Slightly disagree with climate change,-1
1001,This is how you know that the Climate Change hysteria has gotten completely out of control. Who can take this seriously?,Strongly disagree with climate change,-2
1002,"Moderate action isn't enough. Without big, bold solutions now, we're on a path to climate disaster. ",Strongly agree with climate change,2
1003,Face mask for cows among finalists for Prince Charles' climate crisis prize. ,Slightly disagree with climate change,-1
1004,Oil projects must end. I'm sorry jobs might be lost but the climate crisis is real and takes president over individual concerns l We are moving away from being a oil hub and oil jobs are a casualty of that.,Strongly agree with climate change,2
1005,"You got it Steve, there is none!! We will have to do it. UN shown to be failure, so there is no organisation or individual responsible. They're had 26 goes, or no goes. Today Guteries identified it, but they have no plan, no measures, no ideas on climate change. COP 27 coming up! ",Slightly agree with climate change,1
1006,"Indeed. ""Climate change"" has personally broken into my car maybe 150-200 times, assaulted me 50 times, robbed me at gun point too many times to count, invaded my home, tied up and violated me & my wife countless times.",Neutral to climate change,0
1007,American West 'looking down the barrel of a loaded gun' from climate change-driven droughts: scientist ,Strongly agree with climate change,2
1008,"RT The 2021 summer minimum extent was 1.82 million square miles (4.72 million square kilometers), reached on September 16, 2021. This was the 12th-lowest extent in the 43-year satellite record, but the largest extent since 2014. #DemVoice1 ",irrelevant or no opinion on climate change,99
1009,"This #EarthDay is different. We have an opportunity to pass bold climate action that delivers justice, jobs, and cost savings through real clean energy independence. This is our moment. Join us this Saturday and demand Congress seize it: ",Strongly agree with climate change,2
1010,I say Extinction Rebellion Should be A Proscribed Terrorist Group. Who Agrees?,Neutral to climate change,0
1011,What could $44 billion have done for the climate crisis?,Strongly agree with climate change,2
1012,"Ultimately adherence to the law has to take second place to addressing the climate crisis. We're hurtling towards a cliff, the time for asking nicely is over.",Strongly agree with climate change,2
1013,"CNN: The Jackson, MS area has experienced 76 tornadoes in just 35 days this spring. Republicans won't admit climate change/global warming is real because they are taking donation money from & protecting the business interests of the companies doing the damage. #DemVoice1 ",Strongly agree with climate change,2
1014,"Tory MP Brexiter Steve Baker shares paper denying climate crisis. He has also called for the EU to be ""wholly torn down"". Climate science denial and wanting the EU torn down are both stances which favour Putin. Who does Steve Baker work for! ",Slightly agree with climate change,1
1015,global warming really said fuck this census region in specific,Slightly agree with climate change,1
1016,We all need to get more activated and demand a climate policy and an industry/ manufacturing policy that complement each other and are fit for purpose in terms of emissions reductions targets.,Strongly agree with climate change,2
1017,RT Hurricane Ida is showing the untenability of offshore oil and gas amid the climate crisis. #ad,Strongly agree with climate change,2
1018,Can anyone name a single substantive policy proposal put forward by the Republicans this year. A new health care plan? Climate? Deficit Reduction? Job growth? Increased intelligence apparatus? R&D research? Covid relief? Anything? Anyone?,Slightly agree with climate change,1
1019,RT Sheffield 'needs 80% more cyclists and bus journeys' to fight climate crisis ,Strongly agree with climate change,2
1020,RT The report finds that currently plastics are on track to contribute more climate change emissions than coal plants by 2030. And yet... where are they in the BBB or #COP26Glasgow discussions? Nowhere. ,Strongly agree with climate change,2
1021,Former defence force chief Chris Barrie says defence personnel are not allowed to speak out on the national strategic threats posed by climate change without prior approval from Peter Dutton's office. - by ,Neutral to climate change,0
1022,Climate activists are sometimes depicted as dangerous radicals. But the truly dangerous radicals are the countries that are increasing the production of fossil fuels. Investing in new fossil fuels infrastructure is moral and economic madness. #IPCC ,Strongly agree with climate change,2
1023,I don't care about gas prices. I care about alternatives to fossil fuels. Is that cool?,Neutral to climate change,0
1024,RT maybe now is the time to sell big climate change bill,Slightly agree with climate change,1
1025,"The answer is, clearly no. And blaming corporations or billionaires is a political stunt that even left-center moderates see right through. The true *stagflationary* drivers are decoupling, a shift in competitive dynamics for inputs, and global climate change address/transition.",Neutral to climate change,0
1026,"THEY want us to Trust the science BUT WHO IS FUNDING THE SCIENCE, IS A MUCH MORE IMPORTANT QUESTION THEY WANT US TO BELIEVE IN CLIMATE CHANGE BUT SAME PEOPLE TELL US THEIR ARE MORE THAN 2 GENDERS THEY WANT US TO TAKE THE VACCINE WITHOUT QUESTIONING WHO IS MAKING $$ OF IT",Slightly disagree with climate change,-1
1027,"UN Sec'y General released the report saying the war is supercharging a crisis in food, energy & finance in poorer countries already struggling to deal with the pandemic, climate change & a lack of access to adequate funding for economic recovery. ",Slightly agree with climate change,1
1028,"The importance of our built environment cannot keep taking a backseat in climate action. - Unban housing in cities - Eliminate parking minimums - Restrict cars - Spend like mad on walking, biking, rolling, and transit - Ban suburban sprawl ",Strongly agree with climate change,2
1029,"Haha! No, I'm going Hitchens Razor! ""That, that can be asserted without evidence, can be dismissed without evidence"". Have a nice day, climate science denier.",Strongly agree with climate change,2
1030,97% of humanity was completely unharmed by World War II and is now better off on every single metric. And yet for some reason they called it a crisis'  Pielke climate change logic,Strongly disagree with climate change,-2
1031,RT 'Dangerous and delusional': Critics denounce Saudi climate plan || By Robert Kennedy ,Neutral to climate change,0
1032,"Exxon plans to boost spending on oil drilling 45% in 2022. They're not helping solve the climate crisis, they're making it worse. Don't believe anything different. #BigOilLies ",Strongly agree with climate change,2
1033,This climate spiral lays bare the accelerating and dangerous pace at which we're heading towards climate destruction  It shows global temperature anomalies between the years 1880-2021. Even temporarily surpassing 1.5C of global warming could result in severe impacts. ,Strongly agree with climate change,2
1034,"I mean, those that do are only supporting the extinction of the next generation while the previous generation is dying out from old age. Eventually we'll screw ourselves over.",Slightly agree with climate change,1
1035,Who is behind the climate change crisis & terrorism around the world? Aren't they the one who creates the problem & the solution providers? What an evil mind they possess!!! #NoMore order after chaos !!! ,Neutral to climate change,0
1036,I swear I could have a conversation with you about climate change and if you disagreed you'd call me racist lol. Deeply unserious and deeply vapid.,Neutral to climate change,0
