index,text,label_text,label_code
463,"RT Photographer, anthropologist Alegra Ally accompanied the Nenets seasonal migration, under threat from climate crisis, to show the lives of indigenous women in the Siberian Arctic #WomensArt ",Strongly agree with climate change,2
464,"UN Secretary General Antonio Guterres says: coal and other fossil fuels are choking humanity - delay means death' Time to stop all new gas, coal and oil exploration in SA. #saparli #savotes ",Strongly agree with climate change,2
465,"RT The Build Back Better Act includes so many of our progressives priorities, like universal pre-k, home and community-based care, and climate action. And it's fully paid for by making the largest corporations and wealthiest Americans begin to pay their fair share in taxes.",Slightly agree with climate change,1
466,THE MAGNITUDE OF CLIMATE CHANGE IN THE AFTERMATH OF AN ASTEROID IMPACT is one of this science caveats that need careful study. A new study published in prestigious reveals the relevance of Sulphur chemistry just after #Chicxulub impact https://t.co/xI0sBB9GJS Thread 1/4 ,Slightly agree with climate change,1
467,RT 40 dead now from climate change. Just one storm. ,Strongly agree with climate change,2
468,Trudeau will not stop until he destroys every small business. A truck tax will hit contractors on there bottom line over a fake climate change. This m*ther f*cker needs to go now one way or the other,Strongly disagree with climate change,-2
469,"Well, no one is stopping him. What is there more that common folks can do? Never this country has taken preemptive measures to prevent major catastrophes. We only react after: 1/6, Covid, Global Warming, fascism despite obvious warnings.",Slightly agree with climate change,1
470,"Extinction, it's coming to us all, mainly through our own fault ",irrelevant or no opinion on climate change,99
471,"A series of California Legislature reports are out. ""Climate change could alter everything, and spare no one in California..."". It's not too late to stop the most severe effects, so fight on!  ",Strongly agree with climate change,2
472,"I believe in climate change, but I believe the climate change movement is for money, which will lead to more industry, and more climate change. ",Slightly agree with climate change,1
473,So painful to watch North America try to rugged individualism it's way through a pandemic and a climate crisis.,Strongly agree with climate change,2
474,John Kerry the Fraud is worried that the Ukraine War will distract from his money making Scam of Climate Change Kerry is a Heartless Godless Ghoul who is only concerned about making money instead of the suffering of people #GiantSlayers Coming Back Soon! ,Slightly disagree with climate change,-1
475,RT My biggest fear with the climate crisis is that people are going to become numb to extreme weather events that totally should not be happening.,Strongly agree with climate change,2
476,"3/4 Zoroaster's philosophy urges us to put our differences aside and collectively fight the challenges we are facing today, eg climate change, Covid19 and others.",Slightly agree with climate change,1
477,Prince William suggests a living sea wall in the Thames on podcast ,Neutral to climate change,0
478,"RT ""Climate change is taking away country; the very thing used to education our people's and children. Country is their teacher and that is how they learn"" - sharing her wisdom and importance of our own knowledge & education system #IndigenousClimateJustice21",Strongly agree with climate change,2
479,"If you believe climate change is doing this, you're the problem ",Strongly disagree with climate change,-2
480,Bring the Pandas out of almost extinction this year let's grow this community ,irrelevant or no opinion on climate change,99
481,"There's a strong overlap between anti lockdown, pro Brexit, MAGA, pro Putin & climate change deniers. Mostly hoodwinked by the same Russian propaganda.",Neutral to climate change,0
482,"#Fossilfuel companies' lies & deception delayed #ClimateAction and created a #ClimateCrisis that cannot be solved w/o some degree of personal sacrifice. The more the delay, the higher the sacrifice---voluntary or forced (like in #KY or #BC, #Canada). ",Strongly agree with climate change,2
483,"RT For the UK, mass migration is more of a danger than Climate Change.",Slightly disagree with climate change,-1
484,"a) There is no climate change crisis b) Small fluctuations in atmospheric CO2 levels do not drive climate change b) Even If there was a climate change crisis & CO2 levels controlled temperatures, imposing a carbon tax on Canadians, would do practically nothing",Strongly disagree with climate change,-2
485,"I wrote about COP26 and the loss and damage betrayal here. More than 170 developing countries, representing over 6 billion people, demanded loss and damage financing... and they were goaded and patronised by richer nations. ",Neutral to climate change,0
486,"No, they're not. Biden isn't responsible for inflation, gas prices or asylum seekers/migrants impacted from #COVID19, violence, poverty & climate change from seeking a better life in US. US has asylum laws passed by previous Congresses. ",Slightly agree with climate change,1
487,They used covid to destroy lives and are trying the same thing with climate change. Don't fall for the liberal tricks! ,Strongly disagree with climate change,-2
488,The relationship between local and regional extinction rates depends on species distribution patterns https://t.co/gVVjLnIEyr #distribution #extinction #birds #mammals #RStats ,irrelevant or no opinion on climate change,99
489,We are in deep freeze here in NY. I dont know where global warming is but definitely not here.,Slightly disagree with climate change,-1
490,Newsom has it figured out. Create a problem then fix it. Allow crime then increase police. Same with Breed. Soon he'll be doing forest mgmt. correctly & take credit for less fires. Even though did all the leg work. And stupid people will vote for them again&again,irrelevant or no opinion on climate change,99
491,"4. Extreme climate chaos wildfires have destroyed towns in Canada and the US recently, though cities in the global south have already suffered appalling destruction. This is climate violence. Time for rich nations to cough up the billions they've promised. ",Strongly agree with climate change,2
492,Glad we're not in a climate change emergency or anything,Neutral to climate change,0
493,#NatureandUs ambassador will be speaking at this Saturday to mark the launch of the Climate Change Action Caf and #EarthHour2022 The event takes place 10am-12pm. We hope to see you there! ,Slightly agree with climate change,1
494,"This movie is a good metaphor for climate change and other things NO, ONLY CLIMATE CHANGE!! Twitter never ceases to amaze",Neutral to climate change,0
495,Let Them Eat Carbon | Limiting emissions from the poorest countries will not help address climate change. Making them less poor will. My essay with Journal. ,Slightly agree with climate change,1
496,RT It is beyond irresponsible for public figures to rationalize violence like this. We must protect the environment while ensuring extremism isn't normalized. I call upon to condemn this. ,Strongly agree with climate change,2
497,"BLOCKED Esso West Terminal Heathrow Hamble & Hythe Terminals Southampton Even the Energy Secretary has admitted more oil & gas licenses won't address the cost-of-living crisis, won't help with the war in Ukraine & won't give us energy security ",Slightly agree with climate change,1
498,RT COVID-19 cannot be defeated until you surrender all of your money and individual liberty. Climate Change cannot be defeated until you surrender all of your money & individual liberty. Terrorism cannot be defeated until you surrender all of your money & individual liberty. ,Slightly agree with climate change,1
499,"Ever more poor people driving ever more ""inequality, poverty, conflict and hunger"". Ever more rich people driving ever more climate change. ... Ever more people. We truly are a mad species. ",Strongly agree with climate change,2
500,Climate change Greata Woke agenda Cancel culture Transgender Critical race theory BLM They think they're fighting a huge culture war,Neutral to climate change,0
501,The lie about the Climate Crisis debunked in one simple diagram. ,Strongly disagree with climate change,-2
502,-50 wind Chill where I live in Minnesota. We don't have a Climate Change to the warm side up here in the Freezer of the lower 48's.,Neutral to climate change,0
503,RT The poorest people in the poorest places all around the world suffer the worst from pollution. I challenged the Prime Minister yesterday on how we are going to do more to tackle climate change internationally. ,Slightly agree with climate change,1
504,"- Stalin makes Putin look like a masseur. Still resided on world stage - Being inept, sadly, isnt a terminal affliction. - Putin will invent new aims, and populace will swallow it. - Fossil fuels, baby! Sweet, luscious fossil fuels! No matter what, RF oil/gas will NOT stay unsold",Neutral to climate change,0
505,RT ELECTION SECURITY CLIMATE CHANGE VOTING RIGHTS INSURRECTION GUN CONTROL CIVIL RIGHTS SCOTUS COVID ROE All lost for want of courage.,Slightly agree with climate change,1
506,RT moral support' for a carbon-spewing new airport in Kent which all independent reports deem unnecessary. Sec of State has an irrational obsession over airports - he is the wrong man to be making decisions in a climate crisis @GeorgeMonbiot,Strongly agree with climate change,2
507,"RT If we do not move aggressively to combat climate change and if we allow the planet to become increasingly unlivable, we will be showing absolute contempt for our younger generation. It would be grossly immoral to turn our backs on our kids and grandchildren. We must act now.",Strongly agree with climate change,2
508,"These are the signs of impending doom for our planet ! CLIMATE CHANGE is caused by a change in the atmospheres, oceans make up ! To much CO2 and CO dangerous ! ! ",Strongly agree with climate change,2
509,Kenyans should make climate change a priority since it is affecting the country and the threat has come close home. #UhuruLegacy,Strongly agree with climate change,2
510,"I'm gonna laugh my ass off if Elon starts deplatforming climate change ""deniers"" because they threaten his primary business. Everyone will switch from shirts to skins over night. ""Wtf? I love Elon Musk now!"" and ""Wtf? I hate Elon Musk now!""",Neutral to climate change,0
511,"Greta Thunberg: ""We can no longer separate the health crisis from the ecological crisis, and the ecological crisis from the climate crisis. It's all interlinked."" We told you they would never stop ",Strongly agree with climate change,2
512,"More lanes means more cars means more emissions means more warming, and any politician who favors roadway expansion is fundamentally unserious about climate change. ",Strongly agree with climate change,2
513,"White journos have the most access for environmental justice reporting; communities of color & Indigenous communities are the most violently impacted by climate change. asks: who gets to tell this story, and how will it shape the future? ",Slightly agree with climate change,1
514,"No one nation can tackle climate change alone. It is the most significant collective problem we have faced as a global community, said John Kerry emphasizing that leads the way on how int'l orgs must focus on the security aspects of the climate crisis. ",Strongly agree with climate change,2
515,"Kiros and Samrah are having difficulties eating even just once a day. Not because of climate change, but because the Ethiopian government refuses to allow sufficient food, medication and other aid into the region. Because it closed banking, electricity & communications in Tigray. ",Neutral to climate change,0
516,"One of most frightening tweets I have ever seen Of course to most people its irrelevant - because if they realized what it means they would be on streets screaming,demanding climate action This will lock us into a warming that will be our worst nightmare ",Strongly agree with climate change,2
517,"On Saturday we're standing with to protest greedy and callus policy that has limited the lives of the poorest Americans. It's time for Joe Manchin, and every politician, to put our priorities into policy. ",irrelevant or no opinion on climate change,99
518,"The Prime Minister's negative campaign on climate policy does not appear to have cut through in a net-zero world, writes TND's #auspol ",Slightly agree with climate change,1
519,Great to speak to about new report about Facebook pushing climate sceptics further down the conspiracy rabbit hole. Facebook insists it has systems in place to reduce misinformation ,Neutral to climate change,0
520,"2. Five years ago, 20,000 scientists signed a paper stating that to avoid 'vast human misery' economic growth would have to be re-thought. The Intergovernmental Panel on Climate Change has niw indicated that 'degrowth' is one of our only remaining options:",Strongly agree with climate change,2
521,"So says it's unforgivable to forget the unemployment figure. Yet Liberal corruption, cover ups, misogyny, racism, incompetence, wage stagnation, unaffordable housing, declining living standards, global warming, and a lying, cheating PM can all be forgiven? FFS!",Slightly agree with climate change,1
522,"Biodiversity crisis, water scarcity crisis, air pollution crisis, climate crisis, and then there are the facts. ",Slightly disagree with climate change,-1
523,It's a shame we need to rely on a billionaire to mitigate catastrophic climate change instead of our representative leaders. This is the world we now live in.,Strongly agree with climate change,2
524,Why is this Mozilla thread so hated? Is it because they have all crypto? Is it because of climate change? Is it because crypto is a scam?,Neutral to climate change,0
525,It's time we learn to live with cancer. It's time we learn to live with the opioid crisis. It's time we learn to live with climate change. It's time we learn to live with crime. Said no one ever. We are trying to minimize all of these. So why not do the same with Covid?,Slightly agree with climate change,1
526,Climate Change CORRUPTION visiting another Criminal Government,Strongly agree with climate change,2
527,"Thanks to covid, I now know there is no climate emergency.",Strongly disagree with climate change,-2
528,Changing our government is the most effective way to help solve the climate crisis. Full stop.,Strongly agree with climate change,2
529,.the future is renewable: There is no room for fossil fuels or #FossilFools. The best and most immediate solution to SA's energy & unemployment crisis is a #JustTransition to #RenewableEnergy. #StopShell >> https://t.co/eqqvBLoHd7 #ToHellWithShell .,Strongly agree with climate change,2
530,"We're strictly non-violent, but we do harmless things like blocking roads to bring more attention to the messages we're trying to send. A lot of people call us walkers for blocking roads but I'm sure dying in a forest fire as the result of devastating climate change is more wanky",Strongly agree with climate change,2
531,RT Welcome to California This disgusting image is cause by oil companies! Pipelines need to be OUT of this world. To save our oceans we need to STOP using fossil fuels. ! STOP ALL OIL DRILLING IN THE OCEANS ! NOW ! ,Strongly agree with climate change,2
532,FUTURE WE CHOOSE: SURVIVING THE CLIMATE CRISIS PRATIK DESERVES BB TROPHY #PratikIsTheBoss,Strongly agree with climate change,2
533,More CAGW propaganda from the climate science denier.,Slightly agree with climate change,1
534,"RT Kentucky & 5 other states get hit by devastating #tornados ! At least 70 dead, so far, in Kentucky alone!! Tornados in December is not Mother Nature! Its Climate Crisis! Will this wake up Repubs like #MitchMcConnell & #RandPaul, since they represent #Kentucky, to do something?",Strongly agree with climate change,2
535,"I feel like you're not anxious or depressed while global warming, covid, and a ton of other fucked up shits goin on you're either a bad person or something else is wrong with you ",Slightly agree with climate change,1
536,"And I'll add, anyone writing or speaking about it without a strong grasp on human and planetary health and doing so under the guise of climate change only further perpetuates the problem and is not helping. You are part of the problem.",Neutral to climate change,0
537,Humanity's failure to tackle climate change in the 1980s had many causes | Letter ,Slightly agree with climate change,1
538,"So nice to see another fidgety old person with dementia. Nice to see you reassuring us that you will stop fossil fuels from lowering the price of petroleum products. As you rape the Strategic oil Reserve, Not Russia, Biden mistakes! Fuck your clean climate bullshit. Just died!",Slightly disagree with climate change,-1
539,TWELVE DAYS OF DICTATOR TRUMP: Tax breaks for the rich $8 trillion in debt Worsening climate crisis US a global laughingstock Slower mail delivery 55% more hate groups 3 illegitimate SCOTUS justices 800K dead Americans Desecrated US Capitol Building The end of democracy in the US,Slightly agree with climate change,1
540,"5,555 Tigers who lived in fear of extinction, were in for a surprise when others started showing up! Now, there's another battle to fight! Humans https://t.co/dZYJo1QhIQ #EverestCoin #NFT #NFTs #TTigersNFT ",irrelevant or no opinion on climate change,99
541,"Negative #1: When Carbon turns into CO2 and ends up in our atmosphere, it contributes to climate change, which causeswelllots of bad things to our environment and economy, which is why we need to ACT NOW to stop the worst effects and get to net-zero, then net negative. 14/20",Strongly agree with climate change,2
542,Just to play devils advocate here: One might argue adding more T-shirts to the world is almost as bad as burning fossil fuels. Wear what you've got and buy second hand when you need it.,Strongly agree with climate change,2
543,"I seriously doubt it. Globalism, mass-migration and climate change were inevitable and Trump ran on a platform against that.",Slightly agree with climate change,1
544,"Yes, the fake metaverse world. I fear humans (real humans) are going to be near extinction by 2035 if the sheep keep going along with all of this crap.",irrelevant or no opinion on climate change,99
545,"RT In short, it's a scam, it doesn't work & the creation of a global #CarbonOffsets market will just delay real #ClimateAction cutting emissions while protecting and restoring nature. This means saying NO to offsets and YES to ending fossil fuels. #COP26",Strongly agree with climate change,2
546,Browse the LA Room at the UN Climate Conference! StreetsLA's cooling techniques are some of many being showcased. #ClimateAction #urbancooling #LosAngeles @Spottnik,Slightly agree with climate change,1
547,"in times of climate crisis, rising temperatures, rising CO2 emissions, you want to add such powerful value to the global energy problem by calling it technology .. and I'm a moron ?  ",Strongly agree with climate change,2
548,"Rebellion of One stories: 18-year-old Rod blocks a street in Copenhagen because ""politicians do not listen to science and do not deliver on anything close to what's necessary."" Her sign says: ""I'm terrified that war will come because of the climate crisis"" ",Strongly agree with climate change,2
549,"Aged care, climate change, Biloela family, casual workforce, stagnant wages, black deaths in custody, Christian Porter, Craig Kelly, Clive Palmer , vaccines, lies, Hawaii ,rorts, turning back on women in Parlt are some of the reasons the LNP should be voted out @ScottMorrisonMP",Neutral to climate change,0
550,"ENDORSEMENT ALERT! I'm honored to have the support of a dedicated public servant like He works hard every day to help educate our kids, keep our community safe, and he has a plan for addressing climate change. ",Slightly agree with climate change,1
551,"AGW isn't objectively true? Well, well. So it can only be subjectively true then. So it is a belief, not science supported by verifiable cause effect evidence. Now we are making progress. ",Slightly disagree with climate change,-1
552,"That is to say that we should consider the possibility that by 2122, the effect of weather on human lives will be then a further reduction to 1/400th of what it is today, despite climate change. This takes us to a terrible conclusion...",Neutral to climate change,0
553," blind those who would stand against me by posing as a direct threat to humanity. Immeasurable shame gathered the perfect conditions to release the uncontrollable storm wild within my gaze, fostering forest fires that burned the last wisps of dignity. How I ever find ",irrelevant or no opinion on climate change,99
554,"It is useful for clean energy to be cost competitive. However, it should not take Putin's war crimes for capital to shift fast enough to support clean energy investments at a pace consistent with avoiding the worst harms of the climate crisis. It is still disaster capitalism. ",Strongly agree with climate change,2
555,"RT Wonderful to be visiting the #Nigeria pavilion at the #DubaiExpo along with H.E Reem Hashimy, H.E. Mohammed Dansanta Rimi, Dr. Nawal, and other colleagues committed to climate action and an equitable transition in the lead up to #COP26. #SDG7 ",Slightly agree with climate change,1
556,They'll find him. Arrest. $1 bail. Do it seven more times. All charges dropped. Build a statue in his honor. Media sucks his toes. Blame climate change. ,Slightly agree with climate change,1
557,These sadistic geniuses are turning your home into a prison and a slavery plantation. Covid to climate change to implement artificial intelligence communism on steroids.,Slightly disagree with climate change,-1
558,"I mean, the alternative is to scream bloody murder about it to the wind for a few weeks, at the end of which I will be exhausted and sad and climate change will still be spiraling out of control, so yeah, I was gonna ignore it instead of that. ",Slightly agree with climate change,1
559,I was in London in January and prices were $8/gallon. It was all taxes to push the same thing Biden is pushing under climate change,Neutral to climate change,0
560,Delaying the crisis Denying the crisis Ignoring the crisis Mocking the crisis Objecting the crisis Also means INTENSIFYING the crisis. It is already too late. Act NOW. #ClimateCrisis #ClimateAction #ClimateEmergency #climate #IPCC ,Strongly agree with climate change,2
561,"#Climatecrisis : Delay means death: We're running out of ways to adapt to the climate crisis, new report shows. #IPCC ",Strongly agree with climate change,2
562,"Earth is hurtling towards mass extinction. Aloy is headed west to discover why. Join her as she faces fearsome new machines, dangerous enemies, and striking characters across distant lands. Uncover the mystery behind the new collapse and restore balance to life on Earth.",Strongly agree with climate change,2
563,"Every centralized institution is trying to launch their stablecoin. As the largest Dao, why can't the United Nations launch its own stable currency to solve the global hunger crisis, climate crisis, and regional conflicts?",Strongly agree with climate change,2
564,The polls in #Virgina are open!!  6am-7pm EST 11/2  If you want a $15 min wage  Pro-Choice  Climate Action  A believer in Science  and much more.  #VoteTerryMcAuliffe #DemCast #ONEV1 #DemCast Click here to find your polling place ,Slightly agree with climate change,1
565,"there were 3 extreme hurricanes hitting his own country, the entire west coast was on fire, there was flash floods everywhere drowning people etc but it's just bad weather, corporations do no wrong- & top it off w the most misogynistic concept i've encountered in ages, perfection",Strongly agree with climate change,2
566,"RT Since 2018, Australia has lost approx 30% of its koala population, according to independent nonprofit Australian Koala Foundation. Conservationists are blaming the losses on issues related to climate change such as droughts and fires, as well as habitat loss from development. ",Strongly agree with climate change,2
567,Michelle Wu recently participated in an illegal blockade of a major bridge going into South Boston to protest climate change. She is now banning protests in front of her house because she doesn't like what her own medicine tastes like. ,Neutral to climate change,0
568,RT It's important to hear from those on the frontlines of climate change. are you listening? Stop funding the climate crisis. ,Strongly agree with climate change,2
569,Someone has to play the scapegoat to make sure we don't get what we need. What was promised as long as we voted for that one person. Vote here and you'll get$2000! Vote for this and you'll have$15 minimum wage! Give us this and we'll fight climate change! Ha.,Neutral to climate change,0
570,"Keep pushing the click bait cherry picked fear numbers poll, NPR. You forgot to add COVID and catastrophic global warming scare. Step your game up.",Slightly disagree with climate change,-1
571,Catastrophic floods that swamped British Columbia last fall were made twice as likely because of #climatechange https://t.co/AUIZyQZtNI ,Strongly agree with climate change,2
572,"Quick, turn global warming back on, it's cold as fuck! ",Neutral to climate change,0
573,RT Minister wants to grant a licence to Flintridge Resources to prospect for gold and other metals in North Leitrim. This would pollute and destroy ecosystems and make NO SENSE in a climate emergency!!! Here's why & how you can easily help (please RT): ,Strongly agree with climate change,2
