index,text,label_text,label_code
1481,"It isn't ""climate"" that plagues Zambia. ""After independence Zambia adopted a left-wing economic policy. The economy was to some extent run by central planning, under five year plans, private companies were nationalised and incorporated into large state-owned conglomerates."" ",Neutral to climate change,0
1482,Decades of misinformation are coming back to haunt oil companies. ,irrelevant or no opinion on climate change,99
1483,"  Climate Change is making floods and extreme rainfall more likely and more dangerous. Floods can cause illness, injury and even death. Let's work for #HealthierTomorrow More: https://t.co/BkliqlrN8L ",Strongly agree with climate change,2
1484,I hope they remember to do their part and turn off the lights before they meet DeCaprio on his 230 gal/hr diesel yacht to dine on Gates synthetic Chateaubriand before jumping on his private helicopter to fly to Calgary to blame a Chinook on climate change. ,Strongly agree with climate change,2
1485,RT Does Adam Bandt not get that the ALP is NOT in Govt? Ffs mate.put the pressure on where it's due! The LNP Govt. Its lack of climate policy. It's woefully poor record. It's abysmal international record. Stop going after the ALP. It's NOT IN GOVT.Make an alliance. Ffs,Slightly agree with climate change,1
1486,"Russia is one of the world's leading producers of fossil fuels. The second largest exporter behind the United States. When burned fossil fuels release large amounts of carbon dioxide, a greenhouse gas, trapping heat in the atmosphere, causing global warming. #ClimateCrisis ",Slightly agree with climate change,1
1487,Interesting take. Dread of bad events isn't necessarily declinism. Fear is rational if you're tied to a railroad track and a train is coming. Climate change and weakening democracy are real. Happy talk about how nothing bad has ever happened in the past won't make them go away,Slightly agree with climate change,1
1488,"Using the horrors of the invasion in Ukraine , and the death and destruction involved , to support his own electoral prospects and Climate Change denial is an obscenity . He is a disgrace to humanity and every aspect of this nation ",Strongly agree with climate change,2
1489,Based on their overwhelming commitment to climate change AND the pandemic mandates they've all enforced on their countries and citizens this year you'd think they'd just make it a Zoom meeting event yea? ,Neutral to climate change,0
1490,The youngest generations may feel that they have the smallest ability to impact the devastating effects of climate change at the moment but also shoulder the burden of its future effects. ,Slightly agree with climate change,1
1491,RT Climate protesters heckle world leaders tonight in Glasgow for their failure to take urgent action on the crisis. Dignitaries are attending a banquet amid a heavy police presence. #COP26 #Skotia ,Neutral to climate change,0
1492,"Beast Wars: Extinction ""IT'S A TRAP!"" #transformers #beastwars ",irrelevant or no opinion on climate change,99
1493,'The empirical observations I have reviewed show very gentle warming and no evidence of a climate crisis. Spot on. ,Strongly disagree with climate change,-2
1494,"Dr. Geert Vandenbosch had a video interview out in December 2020, and it changed my perspective, everything he described is happening, praying that it will never become a human extinction event!",Strongly agree with climate change,2
1495,FIGHTING CLIMATE CHANGE MEANS FIGHTING CORRUPTION...welcome to a different sort of permanent attack on the present. [Llewelyn Pritchard MA 21 Feb 21] #Nature #Solidarity #StrongerTogether #ClimateGenocideActNow #EndSARS #humanrights ,Slightly agree with climate change,1
1496,"RT Bitcoin will fix the climate crisis by destroying the money printers of governments who finance insane hysterics to go around pretending there is a climate crisis, forcing them to learn to do something productive with their lives instead, or starve. Bitcoin fixes everything.",Strongly disagree with climate change,-2
1497,RT Action needed! Politicians listening to scientists needed! #Climate $ needed! Politicians with integrity needed! More climate activists needed! Jail for climate activists NOT needed! Vanessa & her generation NEEDED! ,Strongly agree with climate change,2
1498,Burning fossil fuels so people can drink outside. I guess the climate crisis is over.,Slightly agree with climate change,1
1499,One thing I would suggest to JordanbPeterson is to shut the heck up and quit having public nervous breakdowns while he encourages people to ignore global warming.,Slightly agree with climate change,1
1500,A Nobel Prize-winning network of climate scientists has been informing the world about global warming for three decades. One researcher says it's time to pack it all in. ,Strongly agree with climate change,2
1501,Sitting having coffee on a town bench They're ruining beautiful days causing more climate crisis & harm to environmental health ,Slightly agree with climate change,1
1502,"One of Biden's campaign promises was to END FOSSIL FUELS. Funny how he only tries to keep the promises that HURT AMERICANS, not help them.",Neutral to climate change,0
1503,"""The game isnt political"" *game proceeds to cover global warming, the effects of war, the horrors of weapons of mass destruction, genocide, consumerism, energy consumption and the harsh realities of overpopulation*",Slightly agree with climate change,1
1504,"We already knew that airlines could not give a sh*t to the climate crisis, now they also could not give a s*it to the covid crisis ",Strongly agree with climate change,2
1505,RT .* Make the fight against climate change sexy & fun! - Shinjiro Koizumi * ,Slightly agree with climate change,1
1506,"RT ""The block holding back the radical action needed to avert the climate crisis isn't technology or public opinion...It's the networks of lobbyists, public relations executives & advertisers who work every day to defend [the current] system"" in ",Strongly agree with climate change,2
1507,"""According to climate scientists, climate departure is 'the moment when average temperatures, either in a specific location or worldwide, become so impacted by climate change that the old climate is left behind. It's going to be hot all the time",Slightly agree with climate change,1
1508,There was a gaping hole in the ozone layer when I was younger with global cooling being a concern then along came global warming and now we have climate change. Thank goodness the scientists know what they're doing because I can barely keep up with it all.. #COP26Glasgow,Neutral to climate change,0
1509,"RT It's Adaptation, Loss and Damage Day at #COP26 We must protect people and natural habitats from the worst effects of climate change. Learn more #TogetherForOurPlanet",Strongly agree with climate change,2
1510,aT EWE: The science of attributing extreme weather events and its potential contribution to assessing loss and damage associated with climate change impacts. ,Strongly agree with climate change,2
1511,"Fossil fuels are poison. Not only poison to our atmosphere, land & water. Poison to our health. Poison to our politics & democracy. Poison to media. Poison to peace. From Russia to Canada & everywhere. The sooner we are done with them the better we will be. Hasten the day.",Strongly agree with climate change,2
1512,Australia's climate change policies are so disappointing. ,Slightly agree with climate change,1
1513,"No, because the time zones will all have to be rearranged. Do away with daylight saving time, and then run your life according to the natural cycle of day and night.",irrelevant or no opinion on climate change,99
1514,"RT Great to celebrate the #PromiseToThePlanet campaign today. The Scouts are working to raise awareness of the consequences of climate change, and encouraging individual as well as collective action to address it. #TogetherForOurPlanet ",Slightly agree with climate change,1
1515,"There's a lot more anger up here in Queensland about mixed messaging causing a day inconvenience for parents than calculated, deceitful messaging causing a lifetime of catastrophic climate change for their children",Strongly agree with climate change,2
1516,"RT When people wonder what loss & damage means in a climate change context, it means tragedies like this. Malaysia needs to step up on climate adaptation and loss & damage, not just focus on reducing greenhouse gases. We ARE vulnerable. Some of us are more vulnerable than others. ",Strongly agree with climate change,2
1517,"An End to the Global Feudal Mob$ter and their Entropic (Ecocide, Homicide, Espionage, Offshore, Black Market, Warfare) Slave-Extinction Economics ... ",Neutral to climate change,0
1518,And you probably believe climate change is a real crisis. ,Slightly disagree with climate change,-1
1519,Little Baby Doge Little Baby Doge is a team of climate change activists on a mission to fight global warming. Website https://t.co/lIILPRaBYZ ,Slightly agree with climate change,1
1520,"It feels like a new genre, ""Reality Movie"" It exposes the climate crisis the way the Lorax exposed the stupidity of bottled water. It also exposes the importance of hair to appearance. * The snack $ under-plot is so good; how boldly being a grifter has no consequence.",Strongly agree with climate change,2
1521,"Due to extreme weather and for the safety of drivers, the is temporarily closing the DVP and Gardiner. All ramps will be closed. This is to help move any existing vehicles that are stuck and allow snow plows to clear the routes.",irrelevant or no opinion on climate change,99
1522,"There are many ways in which one can act. I would suggest everyone focus on their own lifestyle by reducing plastic consumption, eating cautiously, and reducing personal waste. Like this, I believe we would make great accomplishments in the fight against climate change.",Slightly agree with climate change,1
1523,"Governments around the world poured trillions into economy, urging people to spend. Biden's $1.9 trillion gift to oligarchs was the worst. Buying votes backfired -sparked runaway inflation that's made hard working folks poorer. Oh did I mention the impact of war on fossil fuels? ",irrelevant or no opinion on climate change,99
1524,Climate change threatens to destroy democracy and schools are the best solution we've got. A thread 1/ ,Strongly agree with climate change,2
1525,"Occupied basements are more expensive than above-grade space, account for more embodied carbon, and are becoming more prone to seasonal flooding. In a climate emergency, the rational decision is to ban occupied basements & underground parkades.",Strongly agree with climate change,2
1526,"""The truth has become fatal to the credibility of drug war dinosaurs equivocating their way to political extinction."" History: How a traitorous notion stalled mankind's most precious natural ally via @hemptodaynews",irrelevant or no opinion on climate change,99
1527,"Reducing our dependence on oil is good for our wallets and the planet. The infrastructure law is helping states build EV charging stations, and I'm backing a bill to boost American manufacturing of semiconductors, which would help increase supply of EVs. ",Neutral to climate change,0
1528,"it's probably alot worse on the coast for sure but even it was still bad here for the TV to cut out alot today, the O2 took a hit too lmao it's pure mad it's going to get worse with this climate change",Strongly agree with climate change,2
1529,"RT ""TVA must finally be held accountable for its misuse of ratepayer money and its abuse of the planet."" Check it out this oped from and I calling on TVA to stop prioritizing fossil fuels and seriously tackle climate and energy justice. ",Strongly agree with climate change,2
1530,"When climate scientists warned 20 years ago that extreme weather events in Australia would intensify, accelerate & devastate people's lives,their urgent call for action was grounded in care for us-to avoid the fires & floods that now wreak havoc across our country #auspol #floods ",Strongly agree with climate change,2
1531,"Can't keep watching, this story on flooding in Canada is just an addition to the never ending stream of catastrophes our earth is suffering. I honestly can't do any more to help slow climate change, it's not us, it's #China and #India and #Russia and bent Govs. #C4News",Strongly agree with climate change,2
1532,Economics to prevent social collapse: Kate Raworth & Steve Keen speak to Extinction Rebellion UK. ,Neutral to climate change,0
1533,WHAT BRINGS YOU EVERYTHING TO YOUR PATHETIC ASS GAS AND DIESEL FUEL  fossil fuels are very important to bring all you buy including this phone dumbass ,Neutral to climate change,0
1534,"RT Do you have any remembrance of the total abject terror you experienced? Can you at least imagine? Usually you numb yourself at this point, as a newborn, wanting to die. READ BOOK #devolution #evolution #anthropology #extinction #Earth Pl 20p/157",irrelevant or no opinion on climate change,99
1535,5:40 time mark - #CNN director Charlie Chester reveals the next Global Crisis that will be used to coerce society into political manipulation will be climate change. The mandates are illegal and politically motivated. #Covid19 #BuildBackBetter ,Strongly disagree with climate change,-2
1536,"The power of the sun, of the people and of politics. The climate depends on all 3. ""... we need you to be leaders. They are senators from a state that has seen the impacts of climate change significantly."" via @azcentral",Strongly agree with climate change,2
1537,"Former Trudeau Environment Minister Catherine McKenna fighting climate change one unnecessary flight at a time. Oh, and she turned off comments from people not following her. LOL. Coward. ",Strongly disagree with climate change,-2
1538,"RFA CEO Geoff Cooper argues that allowing greater use of American-made #ethanol lowers pump prices, improves air quality and fights climate change. ",Slightly agree with climate change,1
1539,So they don't want to protect the farmers from catastrophic climate change. They are just using this as a way to get money. Got it.,Strongly agree with climate change,2
1540,Hey Progressives did this since 2015 in BC where they were warned about the unacceptable condition of the infrastructure in a diverted lake bed...what happened when the disaster hit? Blamed climate change. Works for arsons in our forrests too.,Slightly disagree with climate change,-1
1541,"RT California is denying fracking permits in droves, two years ahead of Newsom's proposed 2024 ban It's the first time that oil regulators have cited climate change in denying permits, a rationale being fought in court w/ @sfchronicle",Neutral to climate change,0
1542,"It amazes me that these delusional anti-vax twits spew their disbelief and misinformation under their veil of Christianity and Patriotism- and yet they foolishly ignore that THEY'RE the ones dying. Believe yourselves into extinction, dummies. Science doesn't care. Me neither.",Strongly agree with climate change,2
1543,"RT If we are to avoid catastrophic climate change, we must transform our energy system from one that burns fossil fuels to one that is powered by 100% clean energy. ",Strongly agree with climate change,2
1544,"6/ As Paul Romer once said: A crisis is a terrible thing to waste. I'm sure there are many lessons we can learn from the horror of Putin's war on Ukraine. For me, at least one of them is this: fossil fuels = despotism & war. End. #UkraineRussianWar, #Ukraine, #ClimateCrisis",Strongly agree with climate change,2
1545,Us comms pros love a podcast. If you're hunting for your afternoon listen look no further! #MakeChangeHappen supports positive change and the latest episode explores how gender equity and intersectionality approaches are central to climate justice.  ,Slightly agree with climate change,1
1546,There's no place for gas in a climate-safe future. It's time for Massachusetts to get serious about phasing out this dangerous greenhouse gas. Great piece by two advocates! ,Strongly agree with climate change,2
1547,. knows what's best for HIS own bank account Manchin & his family make millions off coal & fossil fuels While West Virginians are among the poorest people in the USA Total corruption ,Neutral to climate change,0
1548,John Kerry frets that Russian brutality will distract from climate change. His comments aren't a gaffe. ,Slightly agree with climate change,1
1549,".is an organization working tirelessly to help countries and communities mitigate the causes of climate change + adapt to the environmental, economic, and social impacts that are already here. Learn more",Strongly agree with climate change,2
1550,"Funny how mandated ignorance on climate change comes to bite you in the ass, especially in a free market with little to no public interest regulation. Who'd have thought there's real costs to waging pointless culture wars while ignoring one's day job?",Slightly agree with climate change,1
1551,"In 2019, AOC said we're all going to die in 12 years. We have 9 years left. So if Covid doesn't kill you then climate change will. We're all going to die!!! ",Strongly agree with climate change,2
1552, 'Digging out' rotten roots of government mismanagement UK in our climate crisis. Why not have a dig'? [Llewelyn Pritchard MA] 19 Jan 2022 #RootCauses #ClimateCrisis #ProtectTheSacred #Unite #Unify #EndSARS #FridaysForFuture,Strongly agree with climate change,2
1553,"2/2 things like voting rights and climate change have too many moving parts for a shallow media to understand and explain otherwise, they would be telling us daily of the urgency to our Democracy and survival. Instead, we get the daily vomit from the previous loser President.",irrelevant or no opinion on climate change,99
1554,"RT Wealth distribution = climate change. Follow the money trail, $$$ Are you awake yet?",Neutral to climate change,0
1555,"FOSSIL FUELS ARE WRONG. GO NUCLEAR AND GO SOLAR, THERE ARE NO ALTERNATIVES LEFT. ",Strongly agree with climate change,2
1556,"President Trump destroys the greatest hoax ever perpetrated, Climate Change ",Strongly disagree with climate change,-2
1557,$750 billion in climate disasters is just about the size of the 2021 Defense budget. Don't let anyone tell you we can't afford to respond to the climate crisis. ,Strongly agree with climate change,2
1558,Experts say: Children not Naughty Enough to Solve our Climate Crisis. You'll never believe the cool trick this North Pole Saint has in mind to change that. ,Neutral to climate change,0
1559,What about you promises to climate change ? Running around in a gas guzzler bus.,Slightly agree with climate change,1
1560,"RT We know that if we're to meet our climate commitments, we must put in the work. I'm in New York with to discuss how our Build Back Better Framework and Bipartisan Infrastruture Deal will create millions of jobs and improve communities as we tackle the climate crisis.",Strongly agree with climate change,2
1561,there is no conspiracy to force us to use fossil fuels we use fossil fuels because they make our lives better ,Neutral to climate change,0
1562,"RT While e-bikes might be cheating, it's not the kind of cheating you may think. You cheat car ownership and sedentary lifestyle. You cheat high emissions and fossil fuels while having a blast. ",Neutral to climate change,0
1563,"The most obvious thing is that it's made me more pessimistic about avoiding climate catastrophe. All the things that make solving the pandemic difficult are also the things that make solving climate change difficult, but orders of magnitude more so. ",Strongly agree with climate change,2
1564,"#ClimateStrike #FridaysForFuture The reason why we need to stop the Matarbari Coal-Fired Power Project is not only because it destructively emits greenhouse gases. Bangladesh is already experiencing severe damage from floods, cyclones and storm surges due to climate change.  ",Strongly agree with climate change,2
1565,"Cancel Culture, Climate Change, Critical Race Theory, COVID-Vaccine pair, Vaccine Passport, Mask mandata, Illegal immigrant, Big Tech, Main Media, Social Media Censorship, more.. It all has a common goal: the New World Order. ",Slightly disagree with climate change,-1
1566,Try this question about greenhouse gas emissions..........it's an important one ,Neutral to climate change,0
1567,"Oh look, climate change is making it snow on Cuba! Oh wait my bad, that's Canada. ",Slightly agree with climate change,1
1568,Colorado shows what's possible when a state takes induced demand seriously. In the NY Times: ,irrelevant or no opinion on climate change,99
1569,Climate change? So you exept the fact that the climate changes dit thousands of years? Remarkable! ,Slightly disagree with climate change,-1
1570,"With Russia's war in Ukraine worsening a global energy crisis, new reports have come to similar conclusions about what nations need to do to secure their energy future while hitting climate targets ",Strongly agree with climate change,2
1571,"again not interested in crime, even when presented with incontrovertible evidence. Don't prosecute: & footballers. Crack down on: women holding vigil for victim of rape & murder by 1 of their own & climate change protestors. #metpolicecorruption",Slightly disagree with climate change,-1
1572,You can't run a factory on renewable energy and we don't need to. Climate crisis is their fake crisis.,Strongly disagree with climate change,-2
1573,Look here > BETO'S CLIMATE PLAN-MSNBC 1/3 This marking the first major policy rollout of the 2020 Democratic contender's campaign. Stephanie Ruhle goes over Beto O'Rourke's Climate Plan point by point. She doesn't even mention THE GREEN NEW DEAL once. 4/29/19 ,Neutral to climate change,0
1574,"At the intersections of Hollywood, the prison industrial complex & climate chaos, the folks of are manifesting creative ways to defend, fight and build. #newepisode of ",Strongly agree with climate change,2
1575,Because of stupid climate change nutters. They forecast acid rain would kill all trees in Scotland a few years ago.,Strongly disagree with climate change,-2
1576,"""A climate-related narrative has already been built in the country to an extent, but if we are not ready to declare a climate emergency on a state level and in a serious way, we should be ready to face the worst consequences,"" writes Fatima Faraz ",Strongly agree with climate change,2
1577,professional scientists were arrested after warning us about the alarming and dangerous impact of increasing the production of fossil fuels and other pollution in the environment. check these hashtags: #LetTheEarthBreath #Scientistprotest #ProtectMotherEarth #ScientistRebellion ,Strongly agree with climate change,2
1578,"via @YouTube Why UN failing to incorporate Spirituality,both for understanding/fighting Climate-Change?UN is going to plunge us into:Ecological-Collapse. useful. Need for making UN answerable.COP:Lobbyists to gain with UN backing!",Slightly agree with climate change,1
1579,RT Shareholder engagement is a deadly distraction that delays climate action. & must divest from fossil fuels NOW to weaken the political power of carbon-polluting companies powering the climate crisis. Read more: ,Strongly agree with climate change,2
1580,"No. Instead of the current system I will take over for 5 years. During which time I shall institute proper democracy, get the corporations out of that democracy, solve world peace, climate change and deal with the far right, before abolishing the monarchy. Fair enough?",Slightly agree with climate change,1
1581,JSW Utkal Steel Ltd received environmental clearance from the Union Ministry of Environment and Forest and Climate Change for setting up a greenfield Integrated Steel Plant of 13.2 million tonnes per annum crude steel in Odisha state. #MakeinIndia,irrelevant or no opinion on climate change,99
1582,phineas and ferb wouldn't have let the climate crisis get this bad,Strongly agree with climate change,2
1583,It's always telling when an opponent seeks to change the facts about the person they're running against. THESE are the facts. is one of only a handful of leaders in the Congress who understands and effectively acts on climate issues. Period. #IL06 ,Slightly agree with climate change,1
1584,The West and Russia are killing Africa as they invest billions in new fossil fuel project and mine the Arctic Brink of Catastrophe': Drought Worsens Humanitarian Crisis in East Africa Experts warn of the driest conditions in over four decades ,Strongly agree with climate change,2
1585,"Global warming, the economy, billionaires screwing everyone!",Slightly agree with climate change,1
1586,People with disabilities experience poverty at greater rate AND face more heightened risk of experiencing severe impacts of climate crisis than people without disabilities. They have to be included in climate decision-making. Need to see more of this at #COP26,Strongly agree with climate change,2
1587,Here's the big thing you need to know about the IPCC report when it comes to climate change and migration. This iteration of the report recognises the limits of adapting to climate change while staying put. [Thread],Slightly agree with climate change,1
1588,Coyne repeatedly lied about Trump for years but he's the truth-teller now and you and I are conspiracy theorists if we challenge Trudeau on COVID or climate. ,Slightly disagree with climate change,-1
1589,"RT After Covid, the next tyrannical, liberty-destroying, and equity-affirming pushwhich will clearly be Climate Changeis going to be met with unprecedented skepticism and opposition. This is very good.",Strongly disagree with climate change,-2
